{"run":37,"commit":"02d2672","metric":99.1667,"metrics":{"reliability_score_v2":100,"packet_score":100,"watchdog_score":100,"recovery_score":100,"overflow_score":100,"tx_score":100,"tx_packet_score":100,"dedup_score":100,"radio_state_score":100,"cover_score":94.1176,"light_score":100,"poll_score":100,"failed_checks":1,"reliability_score_v33":99.1667,"reliability_score_v32":99.1667,"reliability_score_v31":99.1667,"reliability_score_v30":99.1667,"reliability_score_v29":99.1667,"reliability_score_v28":99.1667,"reliability_score_v27":99.1667,"reliability_score_v26":99.1667,"reliability_score_v25":99.1667,"reliability_score_v24":99.1667,"reliability_score_v23":99.1667,"reliability_score_v22":99.1667,"reliability_score_v21":99.1667,"reliability_score_v20":99.1667,"reliability_score_v19":99.1667,"reliability_score_v18":99.1667,"reliability_score_v17":99.1667,"reliability_score_v16":99.1667,"reliability_score_v15":99.1667,"reliability_score_v14":99.1667,"reliability_score_v13":99.1667,"reliability_score_v12":99.1667,"reliability_score_v11":99.1667,"reliability_score_v10":99.1667,"reliability_score_v9":99.1667,"reliability_score_v8":99.1667,"reliability_score_v7":99.1667,"reliability_score_v6":99.1667,"reliability_score_v5":99.1667,"reliability_score_v4":99.1667,"reliability_score":99.1667,"crc_gate_present":0,"unit_seconds":0},"status":"keep","description":"Reinitialized benchmark with cover tilt queue diagnostic helper invariants.","timestamp":1777582931922,"segment":17,"confidence":null,"asi":{"hypothesis":"Tilt commands should publish queue_full diagnostics when command enqueue fails, matching OPEN/CLOSE and light command behavior instead of silently ignoring a requested tilt.","notes":"Current tilt > 0 path only mutates tilt when enqueue succeeds, but queue-full drops are silent; cover_score is 94.12 due missing helper invariant.","next_focus":"Add cover_logic tilt queue helpers and publish queue_full when tilt command capacity is unavailable.","safety":"Checks passed; baseline intentionally exposes silent tilt enqueue failure gap."}}
{"run":38,"commit":"da7cb6b","metric":100,"metrics":{"reliability_score_v2":100,"packet_score":100,"watchdog_score":100,"recovery_score":100,"overflow_score":100,"tx_score":100,"tx_packet_score":100,"dedup_score":100,"radio_state_score":100,"cover_score":100,"light_score":100,"poll_score":100,"failed_checks":0,"reliability_score_v33":100,"reliability_score_v32":100,"reliability_score_v31":100,"reliability_score_v30":100,"reliability_score_v29":100,"reliability_score_v28":100,"reliability_score_v27":100,"reliability_score_v26":100,"reliability_score_v25":100,"reliability_score_v24":100,"reliability_score_v23":100,"reliability_score_v22":100,"reliability_score_v21":100,"reliability_score_v20":100,"reliability_score_v19":100,"reliability_score_v18":100,"reliability_score_v17":100,"reliability_score_v16":100,"reliability_score_v15":100,"reliability_score_v14":100,"reliability_score_v13":100,"reliability_score_v12":100,"reliability_score_v11":100,"reliability_score_v10":100,"reliability_score_v9":100,"reliability_score_v8":100,"reliability_score_v7":100,"reliability_score_v6":100,"reliability_score_v5":100,"reliability_score_v4":100,"reliability_score":100,"crc_gate_present":0,"unit_seconds":0},"status":"keep","description":"Published queue-full diagnostics when cover tilt commands cannot be enqueued.","timestamp":1777582956326,"segment":17,"confidence":null,"asi":{"hypothesis":"Failed cover tilt enqueue attempts should be observable through the same queue_full diagnostic path as movement commands, while still avoiding optimistic tilt-state mutation.","impact":"Tilt queue capacity is now expressed in cover_logic and EleroCover::control publishes queue_full when a positive tilt command cannot be queued; successful tilt behavior is unchanged.","validation":"cover_score improved 94.12 -> 100; reliability_score_v34 improved 99.17 -> 100.","files":"components/elero/elero_cover_logic.h, components/elero/cover/EleroCover.cpp"}}
{"type":"config","name":"Elero reliability: cover stop priority success gating","metricName":"reliability_score_v35","metricUnit":"","bestDirection":"higher"}
{"run":39,"commit":"6ffc11b","metric":99.2,"metrics":{"reliability_score_v2":100,"packet_score":100,"watchdog_score":100,"recovery_score":100,"overflow_score":100,"tx_score":100,"tx_packet_score":100,"dedup_score":100,"radio_state_score":100,"cover_score":95.4545,"light_score":100,"poll_score":100,"failed_checks":1,"reliability_score_v34":99.2,"reliability_score_v33":99.2,"reliability_score_v32":99.2,"reliability_score_v31":99.2,"reliability_score_v30":99.2,"reliability_score_v29":99.2,"reliability_score_v28":99.2,"reliability_score_v27":99.2,"reliability_score_v26":99.2,"reliability_score_v25":99.2,"reliability_score_v24":99.2,"reliability_score_v23":99.2,"reliability_score_v22":99.2,"reliability_score_v21":99.2,"reliability_score_v20":99.2,"reliability_score_v19":99.2,"reliability_score_v18":99.2,"reliability_score_v17":99.2,"reliability_score_v16":99.2,"reliability_score_v15":99.2,"reliability_score_v14":99.2,"reliability_score_v13":99.2,"reliability_score_v12":99.2,"reliability_score_v11":99.2,"reliability_score_v10":99.2,"reliability_score_v9":99.2,"reliability_score_v8":99.2,"reliability_score_v7":99.2,"reliability_score_v6":99.2,"reliability_score_v5":99.2,"reliability_score_v4":99.2,"reliability_score":99.2,"crc_gate_present":0,"unit_seconds":0},"status":"keep","description":"Reinitialized benchmark with cover stop priority success-gating invariants.","timestamp":1777583009855,"segment":18,"confidence":null,"asi":{"hypothesis":"Manual/auto stop state transitions, counter advancement, urgent-defer state, and verification scheduling should only be applied if the priority STOP command was actually enqueued.","notes":"send_stop_priority_ returns success/failure but start_movement(IDLE) ignores it, so priority-queue exhaustion can still mark the cover idle and schedule verification; cover_score is 95.45 due missing helper invariant.","next_focus":"Add cover_logic stop-priority helper and return early from IDLE stop path when priority enqueue fails, avoiding optimistic stop state changes.","safety":"Checks passed; baseline intentionally exposes stop enqueue/state divergence risk."}}
{"run":40,"commit":"e827422","metric":100,"metrics":{"reliability_score_v2":100,"packet_score":100,"watchdog_score":100,"recovery_score":100,"overflow_score":100,"tx_score":100,"tx_packet_score":100,"dedup_score":100,"radio_state_score":100,"cover_score":100,"light_score":100,"poll_score":100,"failed_checks":0,"reliability_score_v34":100,"reliability_score_v33":100,"reliability_score_v32":100,"reliability_score_v31":100,"reliability_score_v30":100,"reliability_score_v29":100,"reliability_score_v28":100,"reliability_score_v27":100,"reliability_score_v26":100,"reliability_score_v25":100,"reliability_score_v24":100,"reliability_score_v23":100,"reliability_score_v22":100,"reliability_score_v21":100,"reliability_score_v20":100,"reliability_score_v19":100,"reliability_score_v18":100,"reliability_score_v17":100,"reliability_score_v16":100,"reliability_score_v15":100,"reliability_score_v14":100,"reliability_score_v13":100,"reliability_score_v12":100,"reliability_score_v11":100,"reliability_score_v10":100,"reliability_score_v9":100,"reliability_score_v8":100,"reliability_score_v7":100,"reliability_score_v6":100,"reliability_score_v5":100,"reliability_score_v4":100,"reliability_score":100,"crc_gate_present":0,"unit_seconds":0},"status":"keep","description":"Gated cover STOP state transitions and verification scheduling on successful priority enqueue.","timestamp":1777583034880,"segment":18,"confidence":null,"asi":{"hypothesis":"STOP-side effects should be committed only after the priority STOP command is accepted, preventing optimistic idle/verification state when all priority enqueue retries fail.","impact":"start_movement(IDLE) now returns early on failed priority STOP enqueue before incrementing stop-urgent, advancing counter, scheduling verification, or changing current_operation; successful stop behavior is preserved.","validation":"cover_score improved 95.45 -> 100; reliability_score_v35 improved 99.20 -> 100.","files":"components/elero/elero_cover_logic.h, components/elero/cover/EleroCover.cpp"}}
{"type":"config","name":"Elero reliability: cover auto-stop priority success gating","metricName":"reliability_score_v36","metricUnit":"","bestDirection":"higher"}
{"run":41,"commit":"f42e77d","metric":99.2308,"metrics":{"reliability_score_v2":100,"packet_score":100,"watchdog_score":100,"recovery_score":100,"overflow_score":100,"tx_score":100,"tx_packet_score":100,"dedup_score":100,"radio_state_score":100,"cover_score":96.2963,"light_score":100,"poll_score":100,"failed_checks":1,"reliability_score_v35":99.2308,"reliability_score_v34":99.2308,"reliability_score_v33":99.2308,"reliability_score_v32":99.2308,"reliability_score_v31":99.2308,"reliability_score_v30":99.2308,"reliability_score_v29":99.2308,"reliability_score_v28":99.2308,"reliability_score_v27":99.2308,"reliability_score_v26":99.2308,"reliability_score_v25":99.2308,"reliability_score_v24":99.2308,"reliability_score_v23":99.2308,"reliability_score_v22":99.2308,"reliability_score_v21":99.2308,"reliability_score_v20":99.2308,"reliability_score_v19":99.2308,"reliability_score_v18":99.2308,"reliability_score_v17":99.2308,"reliability_score_v16":99.2308,"reliability_score_v15":99.2308,"reliability_score_v14":99.2308,"reliability_score_v13":99.2308,"reliability_score_v12":99.2308,"reliability_score_v11":99.2308,"reliability_score_v10":99.2308,"reliability_score_v9":99.2308,"reliability_score_v8":99.2308,"reliability_score_v7":99.2308,"reliability_score_v6":99.2308,"reliability_score_v5":99.2308,"reliability_score_v4":99.2308,"reliability_score":99.2308,"crc_gate_present":0,"unit_seconds":0},"status":"keep","description":"Reinitialized benchmark with cover auto-stop priority success-gating invariants.","timestamp":1777583082238,"segment":19,"confidence":null,"asi":{"hypothesis":"Auto-stop side effects should be gated on priority STOP enqueue success just like manual stop, otherwise target auto-stop can publish idle/schedule verification after all priority enqueue retries fail.","notes":"Benchmark baseline exposes missing auto-stop-specific helper; implementation was not attempted because user requested autoresearch finalization immediately after this iteration began.","next_action_hint":"If continuing experiments, add cover_logic::should_apply_auto_stop_after_priority_result and gate the is_at_target auto-stop branch on send_stop_priority_ success.","safety":"Checks passed; baseline intentionally exposes auto-stop enqueue/state divergence risk."}}
{"run":42,"commit":"fac8d60","metric":100,"metrics":{"reliability_score_v2":100,"packet_score":100,"watchdog_score":100,"recovery_score":100,"overflow_score":100,"tx_score":100,"tx_packet_score":100,"dedup_score":100,"radio_state_score":100,"cover_score":100,"light_score":100,"poll_score":100,"failed_checks":0,"reliability_score_v35":100,"reliability_score_v34":100,"reliability_score_v33":100,"reliability_score_v32":100,"reliability_score_v31":100,"reliability_score_v30":100,"reliability_score_v29":100,"reliability_score_v28":100,"reliability_score_v27":100,"reliability_score_v26":100,"reliability_score_v25":100,"reliability_score_v24":100,"reliability_score_v23":100,"reliability_score_v22":100,"reliability_score_v21":100,"reliability_score_v20":100,"reliability_score_v19":100,"reliability_score_v18":100,"reliability_score_v17":100,"reliability_score_v16":100,"reliability_score_v15":100,"reliability_score_v14":100,"reliability_score_v13":100,"reliability_score_v12":100,"reliability_score_v11":100,"reliability_score_v10":100,"reliability_score_v9":100,"reliability_score_v8":100,"reliability_score_v7":100,"reliability_score_v6":100,"reliability_score_v5":100,"reliability_score_v4":100,"reliability_score":100,"crc_gate_present":0,"unit_seconds":0},"status":"keep","description":"Gated auto-stop side effects on successful priority STOP enqueue.","timestamp":1777583170749,"segment":19,"confidence":null,"asi":{"hypothesis":"Auto-stop should only commit idle state, counter advancement, stop-urgent deferral, and verification scheduling after the priority STOP command is accepted.","impact":"The is_at_target auto-stop path now returns early on failed priority STOP enqueue, clears the trigger timestamp, and avoids optimistic stop side effects; successful auto-stop behavior is unchanged.","validation":"cover_score improved 96.30 -> 100; reliability_score_v36 improved 99.23 -> 100.","files":"components/elero/elero_cover_logic.h, components/elero/cover/EleroCover.cpp"}}
{"type":"config","name":"Elero reliability: runtime stale-clear counter advancement","metricName":"reliability_score_v37","metricUnit":"","bestDirection":"higher"}
{"run":43,"commit":"b317352","metric":99.2481,"metrics":{"reliability_score_v2":100,"packet_score":100,"watchdog_score":100,"recovery_score":100,"overflow_score":100,"tx_score":100,"tx_packet_score":100,"dedup_score":100,"radio_state_score":100,"cover_score":100,"light_score":100,"poll_score":100,"runtime_score":0,"failed_checks":1,"reliability_score_v36":99.2481,"reliability_score_v35":99.2481,"reliability_score_v34":99.2481,"reliability_score_v33":99.2481,"reliability_score_v32":99.2481,"reliability_score_v31":99.2481,"reliability_score_v30":99.2481,"reliability_score_v29":99.2481,"reliability_score_v28":99.2481,"reliability_score_v27":99.2481,"reliability_score_v26":99.2481,"reliability_score_v25":99.2481,"reliability_score_v24":99.2481,"reliability_score_v23":99.2481,"reliability_score_v22":99.2481,"reliability_score_v21":99.2481,"reliability_score_v20":99.2481,"reliability_score_v19":99.2481,"reliability_score_v18":99.2481,"reliability_score_v17":99.2481,"reliability_score_v16":99.2481,"reliability_score_v15":99.2481,"reliability_score_v14":99.2481,"reliability_score_v13":99.2481,"reliability_score_v12":99.2481,"reliability_score_v11":99.2481,"reliability_score_v10":99.2481,"reliability_score_v9":99.2481,"reliability_score_v8":99.2481,"reliability_score_v7":99.2481,"reliability_score_v6":99.2481,"reliability_score_v5":99.2481,"reliability_score_v4":99.2481,"reliability_score":99.2481,"crc_gate_present":0,"unit_seconds":0},"status":"keep","description":"Reinitialized benchmark with runtime stale-clear counter-advancement invariants.","timestamp":1777583299379,"segment":20,"confidence":null,"asi":{"hypothesis":"Runtime-adopted blind queues should advance the rolling counter when stale-clearing after partial transmission, matching configured cover dispatch semantics and avoiding counter reuse.","notes":"Current runtime stale clear resets send_packets_count without advancing cmd_counter; runtime_score is 0 due missing helper invariant.","next_focus":"Add runtime_blind_logic::should_advance_counter_on_stale_clear and apply it before clearing stale runtime queues.","safety":"Checks passed; baseline intentionally exposes runtime counter reuse risk."}}
{"run":44,"commit":"46611d3","metric":100,"metrics":{"reliability_score_v2":100,"packet_score":100,"watchdog_score":100,"recovery_score":100,"overflow_score":100,"tx_score":100,"tx_packet_score":100,"dedup_score":100,"radio_state_score":100,"cover_score":100,"light_score":100,"poll_score":100,"runtime_score":100,"failed_checks":0,"reliability_score_v36":100,"reliability_score_v35":100,"reliability_score_v34":100,"reliability_score_v33":100,"reliability_score_v32":100,"reliability_score_v31":100,"reliability_score_v30":100,"reliability_score_v29":100,"reliability_score_v28":100,"reliability_score_v27":100,"reliability_score_v26":100,"reliability_score_v25":100,"reliability_score_v24":100,"reliability_score_v23":100,"reliability_score_v22":100,"reliability_score_v21":100,"reliability_score_v20":100,"reliability_score_v19":100,"reliability_score_v18":100,"reliability_score_v17":100,"reliability_score_v16":100,"reliability_score_v15":100,"reliability_score_v14":100,"reliability_score_v13":100,"reliability_score_v12":100,"reliability_score_v11":100,"reliability_score_v10":100,"reliability_score_v9":100,"reliability_score_v8":100,"reliability_score_v7":100,"reliability_score_v6":100,"reliability_score_v5":100,"reliability_score_v4":100,"reliability_score":100,"crc_gate_present":0,"unit_seconds":0},"status":"keep","description":"Advanced runtime blind command counter when stale-clearing a partially transmitted queue.","timestamp":1777583325563,"segment":20,"confidence":null,"asi":{"hypothesis":"Runtime-adopted blinds need the same partial-send stale-clear counter advancement as configured covers to prevent replay-like command counter reuse.","impact":"Runtime queue stale clearing now advances cmd_counter when at least one repeat was already sent before clearing, then resets send_packets_count and queue age as before.","validation":"runtime_score improved 0 -> 100; reliability_score_v37 improved 99.25 -> 100.","files":"components/elero/elero_runtime_blind_logic.h, components/elero/elero_runtime.cpp"}}
