{"run":27,"commit":"d468500","metric":98.9583,"metrics":{"reliability_score_v2":93.75,"packet_score":100,"watchdog_score":100,"recovery_score":100,"overflow_score":100,"tx_score":100,"tx_packet_score":100,"dedup_score":100,"radio_state_score":100,"cover_score":100,"light_score":100,"poll_score":100,"failed_checks":1,"reliability_score_v28":98.9583,"reliability_score_v27":98.9583,"reliability_score_v26":98.9583,"reliability_score_v25":98.9583,"reliability_score_v24":98.9583,"reliability_score_v23":98.9583,"reliability_score_v22":98.9583,"reliability_score_v21":98.9583,"reliability_score_v20":98.9583,"reliability_score_v19":98.9583,"reliability_score_v18":98.9583,"reliability_score_v17":98.9583,"reliability_score_v16":98.9583,"reliability_score_v15":98.9583,"reliability_score_v14":98.9583,"reliability_score_v13":98.9583,"reliability_score_v12":98.9583,"reliability_score_v11":98.9583,"reliability_score_v10":98.9583,"reliability_score_v9":98.9583,"reliability_score_v8":98.9583,"reliability_score_v7":98.9583,"reliability_score_v6":98.9583,"reliability_score_v5":98.9583,"reliability_score_v4":98.9583,"reliability_score":98.9583,"crc_gate_present":0,"unit_seconds":0},"status":"keep","description":"Reinitialized benchmark with queue-full latch clear-after-drop invariants.","timestamp":1777582535576,"segment":12,"confidence":null,"asi":{"hypothesis":"When retry-dropping a command empties a previously full command queue, the queue_full latch should clear so future queue-full episodes can publish diagnostics again.","notes":"Successful sends clear queue_full_published when the queue empties, but retry-drop path currently pops without clearing the latch; dispatch_score is 93.75 due missing helper invariant.","next_focus":"Add dispatch helper should_clear_queue_full_latch_after_drop(queue_empty_after_drop, queue_full_published) and apply after queue.pop() in retry-drop path.","safety":"Checks passed; baseline intentionally exposes queue-full latch stale-state gap."}}
{"run":28,"commit":"ce2fdf6","metric":100,"metrics":{"reliability_score_v2":100,"packet_score":100,"watchdog_score":100,"recovery_score":100,"overflow_score":100,"tx_score":100,"tx_packet_score":100,"dedup_score":100,"radio_state_score":100,"cover_score":100,"light_score":100,"poll_score":100,"failed_checks":0,"reliability_score_v28":100,"reliability_score_v27":100,"reliability_score_v26":100,"reliability_score_v25":100,"reliability_score_v24":100,"reliability_score_v23":100,"reliability_score_v22":100,"reliability_score_v21":100,"reliability_score_v20":100,"reliability_score_v19":100,"reliability_score_v18":100,"reliability_score_v17":100,"reliability_score_v16":100,"reliability_score_v15":100,"reliability_score_v14":100,"reliability_score_v13":100,"reliability_score_v12":100,"reliability_score_v11":100,"reliability_score_v10":100,"reliability_score_v9":100,"reliability_score_v8":100,"reliability_score_v7":100,"reliability_score_v6":100,"reliability_score_v5":100,"reliability_score_v4":100,"reliability_score":100,"crc_gate_present":0,"unit_seconds":0},"status":"keep","description":"Cleared queue-full diagnostic latch when retry-dropping a command empties the queue.","timestamp":1777582555863,"segment":12,"confidence":null,"asi":{"hypothesis":"Retry-drop queue progress should reset stale diagnostic latches just like successful queue drains, otherwise future full queues may not publish queue_full state.","impact":"After a retry-exhausted command is popped, dispatch_commands clears queue_full_published if the queue is empty; non-empty queues keep the latch to avoid repeated diagnostics.","validation":"dispatch_score improved 93.75 -> 100; reliability_score_v29 improved 98.96 -> 100.","files":"components/elero/elero_dispatch_logic.h, components/elero/elero.cpp"}}
{"type":"config","name":"Elero reliability: cover immediate poll command guard","metricName":"reliability_score_v30","metricUnit":"","bestDirection":"higher"}
{"run":29,"commit":"2d249f2","metric":99,"metrics":{"reliability_score_v2":100,"packet_score":100,"watchdog_score":100,"recovery_score":100,"overflow_score":100,"tx_score":100,"tx_packet_score":100,"dedup_score":100,"radio_state_score":100,"cover_score":85.7143,"light_score":100,"poll_score":100,"failed_checks":1,"reliability_score_v29":99,"reliability_score_v28":99,"reliability_score_v27":99,"reliability_score_v26":99,"reliability_score_v25":99,"reliability_score_v24":99,"reliability_score_v23":99,"reliability_score_v22":99,"reliability_score_v21":99,"reliability_score_v20":99,"reliability_score_v19":99,"reliability_score_v18":99,"reliability_score_v17":99,"reliability_score_v16":99,"reliability_score_v15":99,"reliability_score_v14":99,"reliability_score_v13":99,"reliability_score_v12":99,"reliability_score_v11":99,"reliability_score_v10":99,"reliability_score_v9":99,"reliability_score_v8":99,"reliability_score_v7":99,"reliability_score_v6":99,"reliability_score_v5":99,"reliability_score_v4":99,"reliability_score":99,"crc_gate_present":0,"unit_seconds":0},"status":"keep","description":"Reinitialized benchmark with cover immediate-poll command guard invariants.","timestamp":1777582598912,"segment":13,"confidence":null,"asi":{"hypothesis":"Covers with command_check disabled should ignore immediate-poll requests rather than enqueueing RF command byte 0x00, matching the light guard semantics.","notes":"EleroCover::schedule_immediate_poll currently only checks rate limit and queue capacity; cover_score is 85.71 due missing helper invariant.","next_focus":"Add cover_logic::should_schedule_immediate_poll requiring nonzero command_check, queue capacity, and rate-limit expiry, then route EleroCover::schedule_immediate_poll through it.","safety":"Checks passed; baseline intentionally exposes invalid cover immediate-poll command gap."}}
{"run":30,"commit":"464a5f4","metric":100,"metrics":{"reliability_score_v2":100,"packet_score":100,"watchdog_score":100,"recovery_score":100,"overflow_score":100,"tx_score":100,"tx_packet_score":100,"dedup_score":100,"radio_state_score":100,"cover_score":100,"light_score":100,"poll_score":100,"failed_checks":0,"reliability_score_v29":100,"reliability_score_v28":100,"reliability_score_v27":100,"reliability_score_v26":100,"reliability_score_v25":100,"reliability_score_v24":100,"reliability_score_v23":100,"reliability_score_v22":100,"reliability_score_v21":100,"reliability_score_v20":100,"reliability_score_v19":100,"reliability_score_v18":100,"reliability_score_v17":100,"reliability_score_v16":100,"reliability_score_v15":100,"reliability_score_v14":100,"reliability_score_v13":100,"reliability_score_v12":100,"reliability_score_v11":100,"reliability_score_v10":100,"reliability_score_v9":100,"reliability_score_v8":100,"reliability_score_v7":100,"reliability_score_v6":100,"reliability_score_v5":100,"reliability_score_v4":100,"reliability_score":100,"crc_gate_present":0,"unit_seconds":0},"status":"keep","description":"Guarded cover immediate polls against disabled CHECK commands and queue/rate-limit violations via cover_logic helper.","timestamp":1777582624302,"segment":13,"confidence":null,"asi":{"hypothesis":"Covers with command_check disabled should ignore immediate-poll requests instead of enqueueing RF command byte 0x00 after external command echoes.","impact":"EleroCover::schedule_immediate_poll now uses cover_logic::should_schedule_immediate_poll, requiring nonzero CHECK command, queue capacity, and rate-limit expiry before enqueueing.","validation":"cover_score improved 85.71 -> 100; reliability_score_v30 improved 99 -> 100.","files":"components/elero/elero_cover_logic.h, components/elero/cover/EleroCover.cpp"}}
{"type":"config","name":"Elero reliability: light ON-then-dim queue capacity","metricName":"reliability_score_v31","metricUnit":"","bestDirection":"higher"}
{"run":31,"commit":"a595704","metric":99.0476,"metrics":{"reliability_score_v2":100,"packet_score":100,"watchdog_score":100,"recovery_score":100,"overflow_score":100,"tx_score":100,"tx_packet_score":100,"dedup_score":100,"radio_state_score":100,"cover_score":100,"light_score":88.8889,"poll_score":100,"failed_checks":1,"reliability_score_v30":99.0476,"reliability_score_v29":99.0476,"reliability_score_v28":99.0476,"reliability_score_v27":99.0476,"reliability_score_v26":99.0476,"reliability_score_v25":99.0476,"reliability_score_v24":99.0476,"reliability_score_v23":99.0476,"reliability_score_v22":99.0476,"reliability_score_v21":99.0476,"reliability_score_v20":99.0476,"reliability_score_v19":99.0476,"reliability_score_v18":99.0476,"reliability_score_v17":99.0476,"reliability_score_v16":99.0476,"reliability_score_v15":99.0476,"reliability_score_v14":99.0476,"reliability_score_v13":99.0476,"reliability_score_v12":99.0476,"reliability_score_v11":99.0476,"reliability_score_v10":99.0476,"reliability_score_v9":99.0476,"reliability_score_v8":99.0476,"reliability_score_v7":99.0476,"reliability_score_v6":99.0476,"reliability_score_v5":99.0476,"reliability_score_v4":99.0476,"reliability_score":99.0476,"crc_gate_present":0,"unit_seconds":0},"status":"keep","description":"Reinitialized benchmark with light ON-then-dim queue-capacity invariants.","timestamp":1777582681866,"segment":14,"confidence":null,"asi":{"hypothesis":"Light actions that require multiple RF commands, especially ON_THEN_DIM_DOWN from off state, should verify enough queue capacity before marking dimming active; otherwise one free slot can enqueue ON but silently drop DIM_DOWN while still entering dimming state.","notes":"Existing light_logic can determine actions but lacks required-slot/capacity helpers; light_score is 88.89 due helper absence.","next_focus":"Add required_command_slots/can_enqueue_action helpers and use them in EleroLight::write_state before multi-command brightness actions.","safety":"Checks passed; baseline intentionally exposes partial multi-command enqueue gap."}}
{"run":32,"commit":"dd33b02","metric":100,"metrics":{"reliability_score_v2":100,"packet_score":100,"watchdog_score":100,"recovery_score":100,"overflow_score":100,"tx_score":100,"tx_packet_score":100,"dedup_score":100,"radio_state_score":100,"cover_score":100,"light_score":100,"poll_score":100,"failed_checks":0,"reliability_score_v30":100,"reliability_score_v29":100,"reliability_score_v28":100,"reliability_score_v27":100,"reliability_score_v26":100,"reliability_score_v25":100,"reliability_score_v24":100,"reliability_score_v23":100,"reliability_score_v22":100,"reliability_score_v21":100,"reliability_score_v20":100,"reliability_score_v19":100,"reliability_score_v18":100,"reliability_score_v17":100,"reliability_score_v16":100,"reliability_score_v15":100,"reliability_score_v14":100,"reliability_score_v13":100,"reliability_score_v12":100,"reliability_score_v11":100,"reliability_score_v10":100,"reliability_score_v9":100,"reliability_score_v8":100,"reliability_score_v7":100,"reliability_score_v6":100,"reliability_score_v5":100,"reliability_score_v4":100,"reliability_score":100,"crc_gate_present":0,"unit_seconds":0},"status":"keep","description":"Required sufficient light command-queue capacity before starting multi-command brightness actions.","timestamp":1777582713674,"segment":14,"confidence":null,"asi":{"hypothesis":"Brightness actions that need multiple RF commands must reserve enough queue capacity atomically before state transitions such as dimming start are applied.","impact":"ON_THEN_DIM_DOWN now requires two free queue slots via light_logic::required_command_slots/can_enqueue_action; all brightness actions now check capacity before enqueue/state mutation and publish queue_full diagnostics on insufficient capacity.","validation":"light_score improved 88.89 -> 100; reliability_score_v31 improved 99.05 -> 100.","files":"components/elero/elero_light_logic.h, components/elero/light/EleroLight.cpp"}}
{"type":"config","name":"Elero reliability: light state mutation capacity precheck","metricName":"reliability_score_v32","metricUnit":"","bestDirection":"higher"}
{"run":33,"commit":"4ffa1e6","metric":99.0909,"metrics":{"reliability_score_v2":100,"packet_score":100,"watchdog_score":100,"recovery_score":100,"overflow_score":100,"tx_score":100,"tx_packet_score":100,"dedup_score":100,"radio_state_score":100,"cover_score":100,"light_score":92.8571,"poll_score":100,"failed_checks":1,"reliability_score_v31":99.0909,"reliability_score_v30":99.0909,"reliability_score_v29":99.0909,"reliability_score_v28":99.0909,"reliability_score_v27":99.0909,"reliability_score_v26":99.0909,"reliability_score_v25":99.0909,"reliability_score_v24":99.0909,"reliability_score_v23":99.0909,"reliability_score_v22":99.0909,"reliability_score_v21":99.0909,"reliability_score_v20":99.0909,"reliability_score_v19":99.0909,"reliability_score_v18":99.0909,"reliability_score_v17":99.0909,"reliability_score_v16":99.0909,"reliability_score_v15":99.0909,"reliability_score_v14":99.0909,"reliability_score_v13":99.0909,"reliability_score_v12":99.0909,"reliability_score_v11":99.0909,"reliability_score_v10":99.0909,"reliability_score_v9":99.0909,"reliability_score_v8":99.0909,"reliability_score_v7":99.0909,"reliability_score_v6":99.0909,"reliability_score_v5":99.0909,"reliability_score_v4":99.0909,"reliability_score":99.0909,"crc_gate_present":0,"unit_seconds":0},"status":"keep","description":"Reinitialized benchmark with light state-mutation capacity precheck invariants.","timestamp":1777582764670,"segment":15,"confidence":null,"asi":{"hypothesis":"Light state/brightness tracking should not be mutated when the RF command required for the requested action cannot be enqueued, including OFF/ON/DIM single-command actions, not just multi-command dimming.","notes":"Existing capacity helper prevents partial ON_THEN_DIM_DOWN, but OFF/ON paths still mutate tracked state after queue-full drops; light_score is 92.86 due missing precheck helper.","next_focus":"Add should_reject_action_before_state_update() and apply a top-level write_state action-capacity precheck before any is_on_/brightness/dimming mutation.","safety":"Checks passed; baseline intentionally exposes state/RF divergence risk on full command queues."}}
{"run":34,"commit":"07befc6","metric":100,"metrics":{"reliability_score_v2":100,"packet_score":100,"watchdog_score":100,"recovery_score":100,"overflow_score":100,"tx_score":100,"tx_packet_score":100,"dedup_score":100,"radio_state_score":100,"cover_score":100,"light_score":100,"poll_score":100,"failed_checks":0,"reliability_score_v31":100,"reliability_score_v30":100,"reliability_score_v29":100,"reliability_score_v28":100,"reliability_score_v27":100,"reliability_score_v26":100,"reliability_score_v25":100,"reliability_score_v24":100,"reliability_score_v23":100,"reliability_score_v22":100,"reliability_score_v21":100,"reliability_score_v20":100,"reliability_score_v19":100,"reliability_score_v18":100,"reliability_score_v17":100,"reliability_score_v16":100,"reliability_score_v15":100,"reliability_score_v14":100,"reliability_score_v13":100,"reliability_score_v12":100,"reliability_score_v11":100,"reliability_score_v10":100,"reliability_score_v9":100,"reliability_score_v8":100,"reliability_score_v7":100,"reliability_score_v6":100,"reliability_score_v5":100,"reliability_score_v4":100,"reliability_score":100,"crc_gate_present":0,"unit_seconds":0},"status":"keep","description":"Added top-level light action capacity precheck before mutating tracked state or brightness.","timestamp":1777582793558,"segment":15,"confidence":null,"asi":{"hypothesis":"Queue-full RF command drops should not cause optimistic light state mutations; state tracking should only change when the required command slots are available.","impact":"write_state now computes the planned light action before any state mutation and rejects insufficient queue capacity for OFF, ON, DIM_UP/DOWN, and ON_THEN_DIM_DOWN uniformly with queue_full diagnostics.","validation":"light_score improved 92.86 -> 100; reliability_score_v32 improved 99.09 -> 100.","files":"components/elero/elero_light_logic.h, components/elero/light/EleroLight.cpp"}}
{"type":"config","name":"Elero reliability: cover movement state capacity precheck","metricName":"reliability_score_v33","metricUnit":"","bestDirection":"higher"}
{"run":35,"commit":"b8f12e2","metric":99.1304,"metrics":{"reliability_score_v2":100,"packet_score":100,"watchdog_score":100,"recovery_score":100,"overflow_score":100,"tx_score":100,"tx_packet_score":100,"dedup_score":100,"radio_state_score":100,"cover_score":91.6667,"light_score":100,"poll_score":100,"failed_checks":1,"reliability_score_v32":99.1304,"reliability_score_v31":99.1304,"reliability_score_v30":99.1304,"reliability_score_v29":99.1304,"reliability_score_v28":99.1304,"reliability_score_v27":99.1304,"reliability_score_v26":99.1304,"reliability_score_v25":99.1304,"reliability_score_v24":99.1304,"reliability_score_v23":99.1304,"reliability_score_v22":99.1304,"reliability_score_v21":99.1304,"reliability_score_v20":99.1304,"reliability_score_v19":99.1304,"reliability_score_v18":99.1304,"reliability_score_v17":99.1304,"reliability_score_v16":99.1304,"reliability_score_v15":99.1304,"reliability_score_v14":99.1304,"reliability_score_v13":99.1304,"reliability_score_v12":99.1304,"reliability_score_v11":99.1304,"reliability_score_v10":99.1304,"reliability_score_v9":99.1304,"reliability_score_v8":99.1304,"reliability_score_v7":99.1304,"reliability_score_v6":99.1304,"reliability_score_v5":99.1304,"reliability_score_v4":99.1304,"reliability_score":99.1304,"crc_gate_present":0,"unit_seconds":0},"status":"keep","description":"Reinitialized benchmark with cover movement state capacity precheck invariants.","timestamp":1777582843420,"segment":16,"confidence":null,"asi":{"hypothesis":"Cover movement state should not transition to opening/closing when the RF movement command cannot be enqueued, otherwise UI/dead-reckoning can diverge from physical blind state under full command queues.","notes":"start_movement logs queue-full drops but still updates current_operation/movement timers afterward; cover_score is 91.67 due missing helper invariant.","next_focus":"Add cover_logic movement queue helpers and have start_movement return before current_operation/timer mutation when OPEN/CLOSE command capacity is unavailable.","safety":"Checks passed; baseline intentionally exposes cover state/RF divergence risk."}}
{"run":36,"commit":"830de72","metric":100,"metrics":{"reliability_score_v2":100,"packet_score":100,"watchdog_score":100,"recovery_score":100,"overflow_score":100,"tx_score":100,"tx_packet_score":100,"dedup_score":100,"radio_state_score":100,"cover_score":100,"light_score":100,"poll_score":100,"failed_checks":0,"reliability_score_v32":100,"reliability_score_v31":100,"reliability_score_v30":100,"reliability_score_v29":100,"reliability_score_v28":100,"reliability_score_v27":100,"reliability_score_v26":100,"reliability_score_v25":100,"reliability_score_v24":100,"reliability_score_v23":100,"reliability_score_v22":100,"reliability_score_v21":100,"reliability_score_v20":100,"reliability_score_v19":100,"reliability_score_v18":100,"reliability_score_v17":100,"reliability_score_v16":100,"reliability_score_v15":100,"reliability_score_v14":100,"reliability_score_v13":100,"reliability_score_v12":100,"reliability_score_v11":100,"reliability_score_v10":100,"reliability_score_v9":100,"reliability_score_v8":100,"reliability_score_v7":100,"reliability_score_v6":100,"reliability_score_v5":100,"reliability_score_v4":100,"reliability_score":100,"crc_gate_present":0,"unit_seconds":0},"status":"keep","description":"Prevented cover OPEN/CLOSE state transitions when movement command cannot be enqueued.","timestamp":1777582875084,"segment":16,"confidence":null,"asi":{"hypothesis":"Cover movement state should only change after the corresponding OPEN/CLOSE RF command is accepted into the command queue.","impact":"start_movement now rejects OPEN/CLOSE queue-full cases before updating current_operation, movement timers, tilt, or post-movement polling state; queue_full diagnostics are still published.","validation":"cover_score improved 91.67 -> 100; reliability_score_v33 improved 99.13 -> 100.","files":"components/elero/elero_cover_logic.h, components/elero/cover/EleroCover.cpp"}}
{"type":"config","name":"Elero reliability: cover tilt queue diagnostic helper","metricName":"reliability_score_v34","metricUnit":"","bestDirection":"higher"}
