{"run":27,"commit":"5da6fff","metric":100,"metrics":{"reliability_score_v2":100,"packet_score":100,"watchdog_score":100,"failed_checks":0,"reliability_score_v7":100,"reliability_score_v6":100,"reliability_score_v5":100,"reliability_score_v4":100,"reliability_score":100,"crc_gate_present":0,"unit_seconds":0},"status":"keep","description":"Added watchdog escalation helper and integrated healthy-state reset + window-expiry reset logic into radio watchdog path.","timestamp":1776440811221,"segment":9,"confidence":null,"iterationTokens":1967,"asi":{"hypothesis":"Escalation counters should reset when radio returns to healthy RX, preventing stale failures from causing unnecessary escalation to reset/fail states.","impact":"Watchdog state handling is now explicit/testable and aligned with intent documented in comments.","files":"components/elero/elero_watchdog_logic.h, components/elero/elero_cc1101.cpp","validation":"watchdog_score improved 0 -> 100; reliability_score_v8 95.45 -> 100."}}
{"run":28,"commit":"5da6fff","metric":100,"metrics":{"reliability_score_v2":100,"packet_score":100,"watchdog_score":100,"failed_checks":0,"reliability_score_v7":100,"reliability_score_v6":100,"reliability_score_v5":100,"reliability_score_v4":100,"reliability_score":100,"crc_gate_present":0,"unit_seconds":0},"status":"discard","description":"Refactored parser to reuse packet_validation helpers for destination count and bounds checks (behavior-preserving cleanup).","timestamp":1776440839314,"segment":9,"confidence":null,"iterationTokens":1933,"asi":{"hypothesis":"Using shared predicates in parser reduces drift risk between validation helper and runtime logic.","rollback_reason":"No primary metric improvement (already at 100).","next_action_hint":"Define a new reliability target for RX overflow reinit-failure latching to unlock measurable progress beyond current ceiling.","note":"Change appears clean but benchmark policy prefers only metric-improving keeps."}}
{"type":"config","name":"Elero reliability: recovery escalation boundary semantics","metricName":"reliability_score_v9","metricUnit":"","bestDirection":"higher"}
{"run":29,"commit":"c0df671","metric":96.1538,"metrics":{"reliability_score_v2":100,"packet_score":100,"watchdog_score":100,"recovery_score":0,"failed_checks":1,"reliability_score_v8":96.1538,"reliability_score_v7":96.1538,"reliability_score_v6":96.1538,"reliability_score_v5":96.1538,"reliability_score_v4":96.1538,"reliability_score":96.1538,"crc_gate_present":0,"unit_seconds":0},"status":"keep","description":"Reinitialized benchmark to include recovery escalation invariants (reinit-failure progression + watchdog window boundary behavior).","timestamp":1776441032458,"segment":10,"confidence":null,"iterationTokens":126,"asi":{"hypothesis":"Recovery reliability depends on predictable reinit-failure counting and exact window-boundary resets to avoid premature permanent-fail latching.","notes":"recovery_score is 0: helper missing and/or boundary semantics not yet aligned.","next_focus":"Introduce pure recovery helper and remove double-increment reinit-failure path."}}
{"run":30,"commit":"0eb08fd","metric":100,"metrics":{"reliability_score_v2":100,"packet_score":100,"watchdog_score":100,"recovery_score":100,"failed_checks":0,"reliability_score_v8":100,"reliability_score_v7":100,"reliability_score_v6":100,"reliability_score_v5":100,"reliability_score_v4":100,"reliability_score":100,"crc_gate_present":0,"unit_seconds":0},"status":"keep","description":"Added recovery helper and removed double counting in send_command reinit-failure path; made watchdog window expiry boundary inclusive.","timestamp":1776441083305,"segment":10,"confidence":null,"iterationTokens":3353,"asi":{"hypothesis":"Failure escalation should count at most once per failed send cycle, and watchdog window should reset exactly at boundary to avoid stale escalation.","impact":"Prevents premature permanent SPI-failed latching from double increments; makes 60s window behavior deterministic at exact edge.","files":"components/elero/elero_recovery_logic.h, components/elero/elero_cc1101.cpp, components/elero/elero_watchdog_logic.h","validation":"recovery_score improved 0 -> 100; reliability_score_v9 96.15 -> 100."}}
{"type":"config","name":"Elero reliability: RX overflow escalation helper","metricName":"reliability_score_v10","metricUnit":"","bestDirection":"higher"}
{"run":31,"commit":"51bcb2c","metric":96.875,"metrics":{"reliability_score_v2":100,"packet_score":100,"watchdog_score":100,"recovery_score":100,"overflow_score":0,"failed_checks":1,"reliability_score_v9":96.875,"reliability_score_v8":96.875,"reliability_score_v7":96.875,"reliability_score_v6":96.875,"reliability_score_v5":96.875,"reliability_score_v4":96.875,"reliability_score":96.875,"crc_gate_present":0,"unit_seconds":0},"status":"keep","description":"Reinitialized benchmark to include RX overflow escalation helper invariants (overflow-count progression and reinit trigger threshold).","timestamp":1776441122955,"segment":11,"confidence":null,"iterationTokens":126,"asi":{"hypothesis":"Overflow recovery reliability depends on deterministic overflow count progression and clear reinit thresholds under rapid overflow bursts.","notes":"overflow_score is 0 because helper is not yet implemented.","next_focus":"Add pure overflow helper and route process_rx overflow path through it."}}
{"run":32,"commit":"5477ad7","metric":100,"metrics":{"reliability_score_v2":100,"packet_score":100,"watchdog_score":100,"recovery_score":100,"overflow_score":100,"failed_checks":0,"reliability_score_v9":100,"reliability_score_v8":100,"reliability_score_v7":100,"reliability_score_v6":100,"reliability_score_v5":100,"reliability_score_v4":100,"reliability_score":100,"crc_gate_present":0,"unit_seconds":0},"status":"keep","description":"Added RX overflow helper and integrated process_rx overflow escalation logic; corrected boundary invariant to exact 1s cutoff semantics.","timestamp":1776441177587,"segment":11,"confidence":null,"iterationTokens":1301,"asi":{"hypothesis":"Overflow handling should use deterministic count progression with explicit threshold-triggered reinit, and boundary timing semantics should be unambiguous.","impact":"Overflow escalation logic is now centralized/testable; rapid overflows suppress repetitive flushes and escalate cleanly at threshold.","files":"components/elero/elero_overflow_logic.h, components/elero/elero_cc1101.cpp, autoresearch.sh","validation":"overflow_score improved 0 -> 100; reliability_score_v10 96.88 -> 100."}}
{"type":"config","name":"Elero reliability: TX destination sanitization helper","metricName":"reliability_score_v11","metricUnit":"","bestDirection":"higher"}
{"run":33,"commit":"427f03d","metric":97.2973,"metrics":{"reliability_score_v2":100,"packet_score":100,"watchdog_score":100,"recovery_score":100,"overflow_score":100,"tx_score":0,"failed_checks":1,"reliability_score_v10":97.2973,"reliability_score_v9":97.2973,"reliability_score_v8":97.2973,"reliability_score_v7":97.2973,"reliability_score_v6":97.2973,"reliability_score_v5":97.2973,"reliability_score_v4":97.2973,"reliability_score":97.2973,"crc_gate_present":0,"unit_seconds":0},"status":"keep","description":"Reinitialized benchmark to include TX destination sanitization invariants (helper presence + clamping semantics).","timestamp":1776441220397,"segment":12,"confidence":null,"iterationTokens":127,"asi":{"hypothesis":"TX robustness improves when invalid destination counts are sanitized deterministically, especially for group-command edge cases.","notes":"tx_score is 0 because helper is not yet implemented.","next_focus":"Add tx helper and route send_command_internal_ num_dests sanitization through it."}}
{"run":34,"commit":"b0fbd6f","metric":100,"metrics":{"reliability_score_v2":100,"packet_score":100,"watchdog_score":100,"recovery_score":100,"overflow_score":100,"tx_score":100,"failed_checks":0,"reliability_score_v10":100,"reliability_score_v9":100,"reliability_score_v8":100,"reliability_score_v7":100,"reliability_score_v6":100,"reliability_score_v5":100,"reliability_score_v4":100,"reliability_score":100,"crc_gate_present":0,"unit_seconds":0},"status":"keep","description":"Added TX helper for destination-count sanitization and integrated send_command_internal_ to clamp oversized groups to max destinations.","timestamp":1776441245671,"segment":12,"confidence":null,"iterationTokens":1815,"asi":{"hypothesis":"For malformed/oversized group commands, clamping to max destinations is safer and more functional than collapsing to a single destination.","impact":"Preserves group-command intent under invalid num_dests while maintaining bounds safety; sanitization behavior is now testable.","files":"components/elero/elero_tx_logic.h, components/elero/elero_cc1101.cpp","validation":"tx_score improved 0 -> 100; reliability_score_v11 97.30 -> 100."}}
{"type":"config","name":"Elero reliability: TX packet length guards","metricName":"reliability_score_v12","metricUnit":"","bestDirection":"higher"}
{"run":35,"commit":"b0fbd6f","metric":0,"metrics":{"reliability_score_v2":0,"packet_score":0,"watchdog_score":0,"recovery_score":0,"overflow_score":0,"tx_score":0,"tx_packet_score":0,"failed_checks":0,"reliability_score_v11":0,"reliability_score_v10":0,"reliability_score_v9":0,"reliability_score_v8":0,"reliability_score_v7":0,"reliability_score_v6":0,"reliability_score_v5":0,"reliability_score_v4":0,"reliability_score":0,"crc_gate_present":0,"unit_seconds":0},"status":"crash","description":"Introduced v12 benchmark invariants for TX packet-length helper, but probe crashed because helper APIs are not implemented yet.","timestamp":1776441375857,"segment":13,"confidence":null,"iterationTokens":128,"asi":{"hypothesis":"Explicit TX packet-length helper should prevent future max-length regressions by centralizing message-size math/validation.","rollback_reason":"New benchmark referenced missing tx_logic APIs (calculate_msg_len, is_msg_len_valid).","next_action_hint":"Add missing tx packet length helper functions in elero_tx_logic.h, then rerun baseline.","error":"tx_logic::calculate_msg_len / is_msg_len_valid not found"}}
{"run":36,"commit":"d513e5d","metric":100,"metrics":{"reliability_score_v2":100,"packet_score":100,"watchdog_score":100,"recovery_score":100,"overflow_score":100,"tx_score":100,"tx_packet_score":100,"failed_checks":0,"reliability_score_v11":100,"reliability_score_v10":100,"reliability_score_v9":100,"reliability_score_v8":100,"reliability_score_v7":100,"reliability_score_v6":100,"reliability_score_v5":100,"reliability_score_v4":100,"reliability_score":100,"crc_gate_present":0,"unit_seconds":0},"status":"keep","description":"Added TX packet-length helper APIs and integrated send_command_internal_ to validate computed packet size before TX.","timestamp":1776441437726,"segment":13,"confidence":null,"iterationTokens":2010,"asi":{"hypothesis":"Centralizing TX length calculation/validation prevents silent max-packet regressions as protocol fields evolve.","impact":"Introduces explicit guard against oversized TX frames and makes packet-size contract testable.","files":"components/elero/elero_tx_logic.h, components/elero/elero_cc1101.cpp","validation":"tx_packet_score improved 0 -> 100; reliability_score_v12 0 -> 100."}}
{"type":"config","name":"Elero reliability: TX length overflow safety","metricName":"reliability_score_v13","metricUnit":"","bestDirection":"higher"}
{"run":37,"commit":"edcda6b","metric":97.7273,"metrics":{"reliability_score_v2":100,"packet_score":100,"watchdog_score":100,"recovery_score":100,"overflow_score":100,"tx_score":100,"tx_packet_score":75,"failed_checks":1,"reliability_score_v12":97.7273,"reliability_score_v11":97.7273,"reliability_score_v10":97.7273,"reliability_score_v9":97.7273,"reliability_score_v8":97.7273,"reliability_score_v7":97.7273,"reliability_score_v6":97.7273,"reliability_score_v5":97.7273,"reliability_score_v4":97.7273,"reliability_score":97.7273,"crc_gate_present":0,"unit_seconds":0},"status":"keep","description":"Reinitialized benchmark to include TX message-length overflow safety invariant for large num_dests inputs.","timestamp":1776441471399,"segment":14,"confidence":null,"iterationTokens":126,"asi":{"hypothesis":"TX length math should remain safe even under malformed large inputs; uint8 overflow can mask oversize packets.","notes":"tx_packet_score dropped to 75 due overflow-safety invariant failing.","next_focus":"Promote TX length calculation to wider type and validate against max packet size without overflow."}}
{"run":38,"commit":"88b695d","metric":100,"metrics":{"reliability_score_v2":100,"packet_score":100,"watchdog_score":100,"recovery_score":100,"overflow_score":100,"tx_score":100,"tx_packet_score":100,"failed_checks":0,"reliability_score_v12":100,"reliability_score_v11":100,"reliability_score_v10":100,"reliability_score_v9":100,"reliability_score_v8":100,"reliability_score_v7":100,"reliability_score_v6":100,"reliability_score_v5":100,"reliability_score_v4":100,"reliability_score":100,"crc_gate_present":0,"unit_seconds":0},"status":"keep","description":"Hardened TX length math against uint8 overflow by promoting calculate_msg_len/is_msg_len_valid to 16-bit and keeping explicit max-size guard in TX path.","timestamp":1776441505226,"segment":14,"confidence":null,"iterationTokens":2039,"asi":{"hypothesis":"Malformed large destination counts can overflow uint8 length math and accidentally pass validation; wider arithmetic closes this reliability hole.","impact":"Length validation now robust to arithmetic overflow before cast into packet buffer length byte.","files":"components/elero/elero_tx_logic.h, components/elero/elero_cc1101.cpp","validation":"tx_packet_score improved 75 -> 100; reliability_score_v13 97.73 -> 100."}}
{"type":"config","name":"Elero reliability: dedup window helper semantics","metricName":"reliability_score_v14","metricUnit":"","bestDirection":"higher"}
{"run":39,"commit":"f3e4702","metric":97.7778,"metrics":{"reliability_score_v2":100,"packet_score":100,"watchdog_score":100,"recovery_score":100,"overflow_score":100,"tx_score":100,"tx_packet_score":100,"dedup_score":0,"failed_checks":1,"reliability_score_v13":97.7778,"reliability_score_v12":97.7778,"reliability_score_v11":97.7778,"reliability_score_v10":97.7778,"reliability_score_v9":97.7778,"reliability_score_v8":97.7778,"reliability_score_v7":97.7778,"reliability_score_v6":97.7778,"reliability_score_v5":97.7778,"reliability_score_v4":97.7778,"reliability_score":97.7778,"crc_gate_present":0,"unit_seconds":0},"status":"keep","description":"Reinitialized benchmark to include dedup-window helper invariants (duplicate detection and prune boundary semantics).","timestamp":1776441598793,"segment":15,"confidence":null,"iterationTokens":127,"asi":{"hypothesis":"Dedup reliability depends on consistent boundary semantics between duplicate suppression and prune behavior.","notes":"dedup_score is 0 because helper is not yet implemented.","next_focus":"Add dedup helper and route is_duplicate_packet_/prune_dedup_map_ through it."}}
{"run":40,"commit":"9f690a7","metric":100,"metrics":{"reliability_score_v2":100,"packet_score":100,"watchdog_score":100,"recovery_score":100,"overflow_score":100,"tx_score":100,"tx_packet_score":100,"dedup_score":100,"failed_checks":0,"reliability_score_v13":100,"reliability_score_v12":100,"reliability_score_v11":100,"reliability_score_v10":100,"reliability_score_v9":100,"reliability_score_v8":100,"reliability_score_v7":100,"reliability_score_v6":100,"reliability_score_v5":100,"reliability_score_v4":100,"reliability_score":100,"crc_gate_present":0,"unit_seconds":0},"status":"keep","description":"Added dedup helper and integrated duplicate/prune window predicates into CC1101 dedup paths for consistent boundary semantics.","timestamp":1776441626123,"segment":15,"confidence":null,"iterationTokens":2198,"asi":{"hypothesis":"Shared dedup predicates reduce risk of future divergence between duplicate suppression and pruning windows.","impact":"Dedup behavior at window boundaries is now explicit/testable (`<` for duplicate, `>=` for prune).","files":"components/elero/elero_dedup_logic.h, components/elero/elero_cc1101.cpp","validation":"dedup_score improved 0 -> 100; reliability_score_v14 97.78 -> 100."}}
{"type":"config","name":"Elero reliability: recovery outcome reset semantics","metricName":"reliability_score_v15","metricUnit":"","bestDirection":"higher"}
{"run":41,"commit":"cd12c15","metric":98,"metrics":{"reliability_score_v2":100,"packet_score":100,"watchdog_score":100,"recovery_score":85.7143,"overflow_score":100,"tx_score":100,"tx_packet_score":100,"dedup_score":100,"failed_checks":1,"reliability_score_v14":98,"reliability_score_v13":98,"reliability_score_v12":98,"reliability_score_v11":98,"reliability_score_v10":98,"reliability_score_v9":98,"reliability_score_v8":98,"reliability_score_v7":98,"reliability_score_v6":98,"reliability_score_v5":98,"reliability_score_v4":98,"reliability_score":98,"crc_gate_present":0,"unit_seconds":0},"status":"keep","description":"Reinitialized benchmark with recovery-outcome invariants requiring failure counter reset after successful reinit attempts.","timestamp":1776441674143,"segment":16,"confidence":null,"iterationTokens":117,"asi":{"hypothesis":"Successful reinit should clear accumulated failure debt; otherwise transient non-IDLE episodes can falsely trip permanent-fail escalation.","notes":"recovery_score dropped to 85.71 because recovery outcome helper/reset semantics not implemented yet.","next_focus":"Add recovery outcome helper and apply it to send_command_internal_ init result handling."}}
{"run":42,"commit":"7623328","metric":100,"metrics":{"reliability_score_v2":100,"packet_score":100,"watchdog_score":100,"recovery_score":100,"overflow_score":100,"tx_score":100,"tx_packet_score":100,"dedup_score":100,"failed_checks":0,"reliability_score_v14":100,"reliability_score_v13":100,"reliability_score_v12":100,"reliability_score_v11":100,"reliability_score_v10":100,"reliability_score_v9":100,"reliability_score_v8":100,"reliability_score_v7":100,"reliability_score_v6":100,"reliability_score_v5":100,"reliability_score_v4":100,"reliability_score":100,"crc_gate_present":0,"unit_seconds":0},"status":"keep","description":"Added recovery outcome helper and applied it to reset reinit-failure counter on successful reinit in send_command_internal_.","timestamp":1776441709312,"segment":16,"confidence":null,"iterationTokens":2158,"asi":{"hypothesis":"Successful radio reinit should clear consecutive-failure streak; otherwise transient recoveries can still trigger false permanent-failure escalation.","impact":"Recovery accounting now distinguishes failed vs successful reinit outcomes explicitly via helper macro+function.","files":"components/elero/elero_recovery_logic.h, components/elero/elero_cc1101.cpp","validation":"recovery_score improved 85.71 -> 100; reliability_score_v15 98 -> 100."}}
{"type":"config","name":"Elero reliability: TX destination-address availability checks","metricName":"reliability_score_v16","metricUnit":"","bestDirection":"higher"}
{"run":43,"commit":"0052aa0","metric":98.1132,"metrics":{"reliability_score_v2":100,"packet_score":100,"watchdog_score":100,"recovery_score":100,"overflow_score":100,"tx_score":80,"tx_packet_score":100,"dedup_score":100,"failed_checks":1,"reliability_score_v15":98.1132,"reliability_score_v14":98.1132,"reliability_score_v13":98.1132,"reliability_score_v12":98.1132,"reliability_score_v11":98.1132,"reliability_score_v10":98.1132,"reliability_score_v9":98.1132,"reliability_score_v8":98.1132,"reliability_score_v7":98.1132,"reliability_score_v6":98.1132,"reliability_score_v5":98.1132,"reliability_score_v4":98.1132,"reliability_score":98.1132,"crc_gate_present":0,"unit_seconds":0},"status":"keep","description":"Reinitialized benchmark with TX destination-address availability invariants to guard against malformed group commands containing zero/unset destination slots.","timestamp":1776441818265,"segment":17,"confidence":null,"iterationTokens":118,"asi":{"hypothesis":"TX reliability should ensure requested destination count does not exceed actually populated destination addresses.","notes":"tx_score dropped to 80 because tx address helper/integration is not yet implemented.","next_focus":"Add tx address availability helper and enforce nonzero destination count after sanitization in send_command_internal_."}}
{"run":44,"commit":"33686a6","metric":100,"metrics":{"reliability_score_v2":100,"packet_score":100,"watchdog_score":100,"recovery_score":100,"overflow_score":100,"tx_score":100,"tx_packet_score":100,"dedup_score":100,"failed_checks":0,"reliability_score_v15":100,"reliability_score_v14":100,"reliability_score_v13":100,"reliability_score_v12":100,"reliability_score_v11":100,"reliability_score_v10":100,"reliability_score_v9":100,"reliability_score_v8":100,"reliability_score_v7":100,"reliability_score_v6":100,"reliability_score_v5":100,"reliability_score_v4":100,"reliability_score":100,"crc_gate_present":0,"unit_seconds":0},"status":"keep","description":"Added TX destination-address helper and enforced available-address clamping in send_command_internal_ to prevent sending unset/zero destinations.","timestamp":1776441859309,"segment":17,"confidence":null,"iterationTokens":2799,"asi":{"hypothesis":"Command reliability improves when effective destination count is limited to actually populated destination slots.","impact":"Malformed group commands with sparse/empty destination arrays now fail safely or clamp to valid populated prefix.","files":"components/elero/elero_tx_logic.h, components/elero/elero_cc1101.cpp","validation":"tx_score improved 80 -> 100; reliability_score_v16 98.11 -> 100."}}
{"type":"config","name":"Elero reliability: TX effective destination helper","metricName":"reliability_score_v17","metricUnit":"","bestDirection":"higher"}
