{"run":16,"commit":"d81f749","metric":100,"metrics":{"reliability_score_v2":100,"packet_score":100,"watchdog_score":100,"recovery_score":100,"overflow_score":100,"tx_score":100,"tx_packet_score":100,"dedup_score":100,"radio_state_score":100,"cover_score":100,"light_score":100,"failed_checks":0,"reliability_score_v22":100,"reliability_score_v21":100,"reliability_score_v20":100,"reliability_score_v19":100,"reliability_score_v18":100,"reliability_score_v17":100,"reliability_score_v16":100,"reliability_score_v15":100,"reliability_score_v14":100,"reliability_score_v13":100,"reliability_score_v12":100,"reliability_score_v11":100,"reliability_score_v10":100,"reliability_score_v9":100,"reliability_score_v8":100,"reliability_score_v7":100,"reliability_score_v6":100,"reliability_score_v5":100,"reliability_score_v4":100,"reliability_score":100,"crc_gate_present":0,"unit_seconds":0},"status":"keep","description":"Made dimming light brightness publishes fire at the exact interval boundary via a shared light_logic helper.","timestamp":1777582119565,"segment":6,"confidence":null,"asi":{"hypothesis":"Inclusive dimming publish timing removes a one-tick brightness-state update blind spot and aligns light status publishing with cover polling semantics.","impact":"EleroLight::loop now routes dimming publish timing through light_logic::should_publish_dimming with >= semantics; behavior only changes at exact publish interval boundaries.","validation":"light_score improved 0 -> 100; reliability_score_v23 improved 98.63 -> 100.","files":"components/elero/elero_light_logic.h, components/elero/light/EleroLight.cpp"}}
{"type":"config","name":"Elero reliability: cover movement publish inclusive boundary","metricName":"reliability_score_v24","metricUnit":"","bestDirection":"higher"}
{"run":17,"commit":"b010636","metric":98.6842,"metrics":{"reliability_score_v2":100,"packet_score":100,"watchdog_score":100,"recovery_score":100,"overflow_score":100,"tx_score":100,"tx_packet_score":100,"dedup_score":100,"radio_state_score":100,"cover_score":75,"light_score":100,"failed_checks":1,"reliability_score_v23":98.6842,"reliability_score_v22":98.6842,"reliability_score_v21":98.6842,"reliability_score_v20":98.6842,"reliability_score_v19":98.6842,"reliability_score_v18":98.6842,"reliability_score_v17":98.6842,"reliability_score_v16":98.6842,"reliability_score_v15":98.6842,"reliability_score_v14":98.6842,"reliability_score_v13":98.6842,"reliability_score_v12":98.6842,"reliability_score_v11":98.6842,"reliability_score_v10":98.6842,"reliability_score_v9":98.6842,"reliability_score_v8":98.6842,"reliability_score_v7":98.6842,"reliability_score_v6":98.6842,"reliability_score_v5":98.6842,"reliability_score_v4":98.6842,"reliability_score":98.6842,"crc_gate_present":0,"unit_seconds":0},"status":"keep","description":"Reinitialized benchmark with cover movement position-publish inclusive-boundary invariant.","timestamp":1777582169657,"segment":7,"confidence":null,"asi":{"hypothesis":"Dead-reckoned cover position publishes should fire at the exact publish interval boundary, matching cover polling and light dimming publish timing semantics.","notes":"Current EleroCover::loop uses strict `now - last_publish_ > 1000`; new cover publish helper invariant fails, dropping cover_score to 75.","next_focus":"Add cover_logic::should_publish_position with >= semantics and route the moving-position publish check through it.","safety":"Checks passed; baseline intentionally exposes cover publish boundary gap."}}
{"run":18,"commit":"b65bf42","metric":100,"metrics":{"reliability_score_v2":100,"packet_score":100,"watchdog_score":100,"recovery_score":100,"overflow_score":100,"tx_score":100,"tx_packet_score":100,"dedup_score":100,"radio_state_score":100,"cover_score":100,"light_score":100,"failed_checks":0,"reliability_score_v23":100,"reliability_score_v22":100,"reliability_score_v21":100,"reliability_score_v20":100,"reliability_score_v19":100,"reliability_score_v18":100,"reliability_score_v17":100,"reliability_score_v16":100,"reliability_score_v15":100,"reliability_score_v14":100,"reliability_score_v13":100,"reliability_score_v12":100,"reliability_score_v11":100,"reliability_score_v10":100,"reliability_score_v9":100,"reliability_score_v8":100,"reliability_score_v7":100,"reliability_score_v6":100,"reliability_score_v5":100,"reliability_score_v4":100,"reliability_score":100,"crc_gate_present":0,"unit_seconds":0},"status":"keep","description":"Made moving cover position publishes fire at the exact interval boundary via cover_logic helper.","timestamp":1777582204949,"segment":7,"confidence":null,"asi":{"hypothesis":"Inclusive moving-cover publish timing removes a one-tick position-state update blind spot and keeps status publication boundaries consistent across covers and lights.","impact":"EleroCover::loop now routes moving-position publish timing through cover_logic::should_publish_position with >= semantics; behavior only changes at exact publish interval boundaries.","validation":"cover_score improved 75 -> 100; reliability_score_v24 improved 98.68 -> 100.","files":"components/elero/elero_cover_logic.h, components/elero/cover/EleroCover.cpp"}}
{"type":"config","name":"Elero reliability: poll helper inclusive boundary","metricName":"reliability_score_v25","metricUnit":"","bestDirection":"higher"}
{"run":19,"commit":"0437d56","metric":97.5309,"metrics":{"reliability_score_v2":100,"packet_score":100,"watchdog_score":100,"recovery_score":100,"overflow_score":100,"tx_score":100,"tx_packet_score":100,"dedup_score":100,"radio_state_score":100,"cover_score":100,"light_score":100,"poll_score":33.3333,"failed_checks":2,"reliability_score_v24":97.5309,"reliability_score_v23":97.5309,"reliability_score_v22":97.5309,"reliability_score_v21":97.5309,"reliability_score_v20":97.5309,"reliability_score_v19":97.5309,"reliability_score_v18":97.5309,"reliability_score_v17":97.5309,"reliability_score_v16":97.5309,"reliability_score_v15":97.5309,"reliability_score_v14":97.5309,"reliability_score_v13":97.5309,"reliability_score_v12":97.5309,"reliability_score_v11":97.5309,"reliability_score_v10":97.5309,"reliability_score_v9":97.5309,"reliability_score_v8":97.5309,"reliability_score_v7":97.5309,"reliability_score_v6":97.5309,"reliability_score_v5":97.5309,"reliability_score_v4":97.5309,"reliability_score":97.5309,"crc_gate_present":0,"unit_seconds":0},"status":"keep","description":"Reinitialized benchmark with generic poll helper inclusive-boundary invariants.","timestamp":1777582245306,"segment":8,"confidence":null,"asi":{"hypothesis":"The generic poll_logic::should_poll_now helper should share inclusive exact-boundary semantics with cover polling, runtime blind polling, and publish timing helpers.","notes":"Current unused/shared helper still uses strict `>` and lacks a capability macro, so poll_score is 33.33 with two failed invariants.","next_focus":"Add ELERO_HAS_POLL_INCLUSIVE_HELPER and switch poll_logic::should_poll_now to >= semantics.","safety":"Checks passed; baseline intentionally exposes generic helper inconsistency."}}
{"run":20,"commit":"a5cc8a0","metric":100,"metrics":{"reliability_score_v2":100,"packet_score":100,"watchdog_score":100,"recovery_score":100,"overflow_score":100,"tx_score":100,"tx_packet_score":100,"dedup_score":100,"radio_state_score":100,"cover_score":100,"light_score":100,"poll_score":100,"failed_checks":0,"reliability_score_v24":100,"reliability_score_v23":100,"reliability_score_v22":100,"reliability_score_v21":100,"reliability_score_v20":100,"reliability_score_v19":100,"reliability_score_v18":100,"reliability_score_v17":100,"reliability_score_v16":100,"reliability_score_v15":100,"reliability_score_v14":100,"reliability_score_v13":100,"reliability_score_v12":100,"reliability_score_v11":100,"reliability_score_v10":100,"reliability_score_v9":100,"reliability_score_v8":100,"reliability_score_v7":100,"reliability_score_v6":100,"reliability_score_v5":100,"reliability_score_v4":100,"reliability_score":100,"crc_gate_present":0,"unit_seconds":0},"status":"keep","description":"Aligned generic poll_logic::should_poll_now with inclusive exact-boundary polling semantics.","timestamp":1777582257774,"segment":8,"confidence":null,"asi":{"hypothesis":"Shared poll predicates should not preserve a one-tick exact-boundary blind spot after runtime/cover poll paths were made inclusive.","impact":"poll_logic::should_poll_now now uses >= and advertises the inclusive contract via ELERO_HAS_POLL_INCLUSIVE_HELPER; immediate/post-movement helpers remain unchanged.","validation":"poll_score improved 33.33 -> 100; reliability_score_v25 improved 97.53 -> 100.","files":"components/elero/elero_poll_logic.h"}}
{"type":"config","name":"Elero reliability: TX timeout inclusive boundary","metricName":"reliability_score_v26","metricUnit":"","bestDirection":"higher"}
{"run":21,"commit":"b700428","metric":98.7805,"metrics":{"reliability_score_v2":100,"packet_score":100,"watchdog_score":100,"recovery_score":100,"overflow_score":100,"tx_score":100,"tx_packet_score":100,"dedup_score":100,"radio_state_score":80,"cover_score":100,"light_score":100,"poll_score":100,"failed_checks":1,"reliability_score_v25":98.7805,"reliability_score_v24":98.7805,"reliability_score_v23":98.7805,"reliability_score_v22":98.7805,"reliability_score_v21":98.7805,"reliability_score_v20":98.7805,"reliability_score_v19":98.7805,"reliability_score_v18":98.7805,"reliability_score_v17":98.7805,"reliability_score_v16":98.7805,"reliability_score_v15":98.7805,"reliability_score_v14":98.7805,"reliability_score_v13":98.7805,"reliability_score_v12":98.7805,"reliability_score_v11":98.7805,"reliability_score_v10":98.7805,"reliability_score_v9":98.7805,"reliability_score_v8":98.7805,"reliability_score_v7":98.7805,"reliability_score_v6":98.7805,"reliability_score_v5":98.7805,"reliability_score_v4":98.7805,"reliability_score":98.7805,"crc_gate_present":0,"unit_seconds":0},"status":"keep","description":"Reinitialized benchmark with TX state timeout inclusive-boundary invariant.","timestamp":1777582290243,"segment":9,"confidence":null,"asi":{"hypothesis":"TX state timeout should trigger at the exact timeout boundary rather than waiting one additional loop tick, preventing avoidable time spent in stuck transmitting states.","notes":"Current advance_tx uses strict elapsed > TX_STATE_TIMEOUT_MS and no shared helper; radio_state_score drops to 80 from the missing helper invariant.","next_focus":"Add radio_state_logic::has_tx_timed_out with >= semantics and route advance_tx timeout check through it.","safety":"Checks passed; baseline intentionally exposes TX timeout boundary gap."}}
{"run":22,"commit":"9fa0845","metric":100,"metrics":{"reliability_score_v2":100,"packet_score":100,"watchdog_score":100,"recovery_score":100,"overflow_score":100,"tx_score":100,"tx_packet_score":100,"dedup_score":100,"radio_state_score":100,"cover_score":100,"light_score":100,"poll_score":100,"failed_checks":0,"reliability_score_v25":100,"reliability_score_v24":100,"reliability_score_v23":100,"reliability_score_v22":100,"reliability_score_v21":100,"reliability_score_v20":100,"reliability_score_v19":100,"reliability_score_v18":100,"reliability_score_v17":100,"reliability_score_v16":100,"reliability_score_v15":100,"reliability_score_v14":100,"reliability_score_v13":100,"reliability_score_v12":100,"reliability_score_v11":100,"reliability_score_v10":100,"reliability_score_v9":100,"reliability_score_v8":100,"reliability_score_v7":100,"reliability_score_v6":100,"reliability_score_v5":100,"reliability_score_v4":100,"reliability_score":100,"crc_gate_present":0,"unit_seconds":0},"status":"keep","description":"Made TX transmitting-state timeout trigger at the exact timeout boundary via radio_state_logic helper.","timestamp":1777582307801,"segment":9,"confidence":null,"asi":{"hypothesis":"Inclusive TX timeout handling avoids one extra radio-task iteration in stuck transmitting states while keeping timeout policy explicit/testable.","impact":"advance_tx now delegates timeout boundary semantics to radio_state_logic::has_tx_timed_out using >=; normal ISR/completion paths are unchanged.","validation":"radio_state_score improved 80 -> 100; reliability_score_v26 improved 98.78 -> 100.","files":"components/elero/elero_radio_state_logic.h, components/elero/elero_cc1101.cpp"}}
{"type":"config","name":"Elero reliability: watchdog recovery action helper","metricName":"reliability_score_v27","metricUnit":"","bestDirection":"higher"}
{"run":23,"commit":"0a628a4","metric":98.8235,"metrics":{"reliability_score_v2":100,"packet_score":100,"watchdog_score":80,"recovery_score":100,"overflow_score":100,"tx_score":100,"tx_packet_score":100,"dedup_score":100,"radio_state_score":100,"cover_score":100,"light_score":100,"poll_score":100,"failed_checks":1,"reliability_score_v26":98.8235,"reliability_score_v25":98.8235,"reliability_score_v24":98.8235,"reliability_score_v23":98.8235,"reliability_score_v22":98.8235,"reliability_score_v21":98.8235,"reliability_score_v20":98.8235,"reliability_score_v19":98.8235,"reliability_score_v18":98.8235,"reliability_score_v17":98.8235,"reliability_score_v16":98.8235,"reliability_score_v15":98.8235,"reliability_score_v14":98.8235,"reliability_score_v13":98.8235,"reliability_score_v12":98.8235,"reliability_score_v11":98.8235,"reliability_score_v10":98.8235,"reliability_score_v9":98.8235,"reliability_score_v8":98.8235,"reliability_score_v7":98.8235,"reliability_score_v6":98.8235,"reliability_score_v5":98.8235,"reliability_score_v4":98.8235,"reliability_score":98.8235,"crc_gate_present":0,"unit_seconds":0},"status":"keep","description":"Reinitialized benchmark with watchdog recovery-action helper invariants for escalation sequence semantics.","timestamp":1777582384847,"segment":10,"confidence":null,"asi":{"hypothesis":"Watchdog escalation reliability improves when the recovery action decision is explicit and testable as a sequence policy instead of being distributed across check_radio_state_.","notes":"Current code has reset/window helpers but no single pure policy for IDLE restart, overflow flush, generic flush, reset, and fail thresholds; watchdog_score is 80 due helper absence.","next_focus":"Add watchdog_logic::RecoveryAction and choose_recovery_action(), then route check_radio_state_ through it without changing escalation thresholds.","safety":"Checks passed; baseline intentionally exposes sequence-policy gap."}}
{"run":24,"commit":"4b72e8d","metric":100,"metrics":{"reliability_score_v2":100,"packet_score":100,"watchdog_score":100,"recovery_score":100,"overflow_score":100,"tx_score":100,"tx_packet_score":100,"dedup_score":100,"radio_state_score":100,"cover_score":100,"light_score":100,"poll_score":100,"failed_checks":0,"reliability_score_v26":100,"reliability_score_v25":100,"reliability_score_v24":100,"reliability_score_v23":100,"reliability_score_v22":100,"reliability_score_v21":100,"reliability_score_v20":100,"reliability_score_v19":100,"reliability_score_v18":100,"reliability_score_v17":100,"reliability_score_v16":100,"reliability_score_v15":100,"reliability_score_v14":100,"reliability_score_v13":100,"reliability_score_v12":100,"reliability_score_v11":100,"reliability_score_v10":100,"reliability_score_v9":100,"reliability_score_v8":100,"reliability_score_v7":100,"reliability_score_v6":100,"reliability_score_v5":100,"reliability_score_v4":100,"reliability_score":100,"crc_gate_present":0,"unit_seconds":0},"status":"keep","description":"Centralized watchdog recovery escalation decisions in a pure action helper and routed check_radio_state_ through it.","timestamp":1777582416986,"segment":10,"confidence":null,"asi":{"hypothesis":"A single pure watchdog recovery policy makes escalation thresholds and action ordering auditable, reducing risk of drift as watchdog behavior evolves.","impact":"IDLE restart, RX-overflow flush, generic flush, reset, and permanent-fail decisions now flow through watchdog_logic::choose_recovery_action; existing thresholds/action side effects are preserved.","validation":"watchdog_score improved 80 -> 100; reliability_score_v27 improved 98.82 -> 100.","files":"components/elero/elero_watchdog_logic.h, components/elero/elero_cc1101.cpp"}}
{"type":"config","name":"Elero reliability: light immediate poll command guard","metricName":"reliability_score_v28","metricUnit":"","bestDirection":"higher"}
{"run":25,"commit":"972a805","metric":98.9011,"metrics":{"reliability_score_v2":100,"packet_score":100,"watchdog_score":100,"recovery_score":100,"overflow_score":100,"tx_score":100,"tx_packet_score":100,"dedup_score":100,"radio_state_score":100,"cover_score":100,"light_score":75,"poll_score":100,"failed_checks":1,"reliability_score_v27":98.9011,"reliability_score_v26":98.9011,"reliability_score_v25":98.9011,"reliability_score_v24":98.9011,"reliability_score_v23":98.9011,"reliability_score_v22":98.9011,"reliability_score_v21":98.9011,"reliability_score_v20":98.9011,"reliability_score_v19":98.9011,"reliability_score_v18":98.9011,"reliability_score_v17":98.9011,"reliability_score_v16":98.9011,"reliability_score_v15":98.9011,"reliability_score_v14":98.9011,"reliability_score_v13":98.9011,"reliability_score_v12":98.9011,"reliability_score_v11":98.9011,"reliability_score_v10":98.9011,"reliability_score_v9":98.9011,"reliability_score_v8":98.9011,"reliability_score_v7":98.9011,"reliability_score_v6":98.9011,"reliability_score_v5":98.9011,"reliability_score_v4":98.9011,"reliability_score":98.9011,"crc_gate_present":0,"unit_seconds":0},"status":"keep","description":"Reinitialized benchmark with light immediate-poll command guard invariants.","timestamp":1777582480129,"segment":11,"confidence":null,"asi":{"hypothesis":"Light immediate polls should not enqueue a command when command_check is disabled (0x00), otherwise external command echoes can queue invalid RF command bytes for lights without status polling configured.","notes":"setup() already guards command_check != 0x00, but schedule_immediate_poll() does not; light_score is 75 due missing helper invariant.","next_focus":"Add light_logic::should_schedule_immediate_poll requiring nonzero command_check, queue capacity, and rate-limit expiry, then route EleroLight::schedule_immediate_poll through it.","safety":"Checks passed; baseline intentionally exposes invalid immediate-poll command gap."}}
{"run":26,"commit":"3b01bdd","metric":100,"metrics":{"reliability_score_v2":100,"packet_score":100,"watchdog_score":100,"recovery_score":100,"overflow_score":100,"tx_score":100,"tx_packet_score":100,"dedup_score":100,"radio_state_score":100,"cover_score":100,"light_score":100,"poll_score":100,"failed_checks":0,"reliability_score_v27":100,"reliability_score_v26":100,"reliability_score_v25":100,"reliability_score_v24":100,"reliability_score_v23":100,"reliability_score_v22":100,"reliability_score_v21":100,"reliability_score_v20":100,"reliability_score_v19":100,"reliability_score_v18":100,"reliability_score_v17":100,"reliability_score_v16":100,"reliability_score_v15":100,"reliability_score_v14":100,"reliability_score_v13":100,"reliability_score_v12":100,"reliability_score_v11":100,"reliability_score_v10":100,"reliability_score_v9":100,"reliability_score_v8":100,"reliability_score_v7":100,"reliability_score_v6":100,"reliability_score_v5":100,"reliability_score_v4":100,"reliability_score":100,"crc_gate_present":0,"unit_seconds":0},"status":"keep","description":"Guarded light immediate polls against disabled CHECK commands and queue/rate-limit violations via light_logic helper.","timestamp":1777582500118,"segment":11,"confidence":null,"asi":{"hypothesis":"Lights with command_check disabled should ignore immediate-poll requests instead of enqueueing RF command byte 0x00 after external command echoes.","impact":"schedule_immediate_poll now uses light_logic::should_schedule_immediate_poll, requiring nonzero CHECK command, queue capacity, and rate-limit expiry before enqueueing.","validation":"light_score improved 75 -> 100; reliability_score_v28 improved 98.90 -> 100.","files":"components/elero/elero_light_logic.h, components/elero/light/EleroLight.cpp"}}
{"type":"config","name":"Elero reliability: queue-full latch clear after retry drop","metricName":"reliability_score_v29","metricUnit":"","bestDirection":"higher"}
