{"run":45,"commit":"2d8d415","metric":98.2143,"metrics":{"reliability_score_v2":100,"packet_score":100,"watchdog_score":100,"recovery_score":100,"overflow_score":100,"tx_score":87.5,"tx_packet_score":100,"dedup_score":100,"failed_checks":1,"reliability_score_v16":98.2143,"reliability_score_v15":98.2143,"reliability_score_v14":98.2143,"reliability_score_v13":98.2143,"reliability_score_v12":98.2143,"reliability_score_v11":98.2143,"reliability_score_v10":98.2143,"reliability_score_v9":98.2143,"reliability_score_v8":98.2143,"reliability_score_v7":98.2143,"reliability_score_v6":98.2143,"reliability_score_v5":98.2143,"reliability_score_v4":98.2143,"reliability_score":98.2143,"crc_gate_present":0,"unit_seconds":0},"status":"keep","description":"Reinitialized benchmark with TX effective-destination helper invariants to ensure sanitized destination count aligns with populated address availability.","timestamp":1776441916149,"segment":18,"confidence":null,"iterationTokens":117,"asi":{"hypothesis":"Encapsulating effective destination calculation prevents divergence between sanitization and availability clamping logic.","notes":"tx_score dropped to 87.5 because effective-destination helper is not yet implemented.","next_focus":"Add effective_num_dests helper in tx_logic and use it in send_command_internal_."}}
{"run":3,"commit":"d6822ef","metric":100,"metrics":{"reliability_score_v2":100,"packet_score":100,"watchdog_score":100,"recovery_score":100,"overflow_score":100,"tx_score":100,"tx_packet_score":100,"dedup_score":100,"failed_checks":0,"reliability_score_v17":100,"reliability_score_v16":100,"reliability_score_v15":100,"reliability_score_v14":100,"reliability_score_v13":100,"reliability_score_v12":100,"reliability_score_v11":100,"reliability_score_v10":100,"reliability_score_v9":100,"reliability_score_v8":100,"reliability_score_v7":100,"reliability_score_v6":100,"reliability_score_v5":100,"reliability_score_v4":100,"reliability_score":100,"crc_gate_present":0,"unit_seconds":0},"status":"keep","description":"Restored inclusive dispatch stale/readiness/retry boundary semantics after resume regression (retry commit with workingDir config).","timestamp":1777581714835,"segment":0,"confidence":null,"asi":{"hypothesis":"Dispatch reliability requires inclusive threshold semantics to avoid one-tick blind spots at exact delay/stale/retry boundaries.","impact":"Restores prior reliability intent after current HEAD regressed to strict greater-than checks.","validation":"dispatch_score improved 66.67 -> 100; reliability_score_v17 improved 94.92 -> 100.","files":"components/elero/elero_dispatch_logic.h","note":"Previous keep log could not commit because tool cwd was /root; workingDir config was added for subsequent autoresearch operations."}}
{"type":"config","name":"Elero reliability: full payload bounds validation","metricName":"reliability_score_v18","metricUnit":"","bestDirection":"higher"}
{"run":4,"commit":"2c7d4d9","metric":96.6102,"metrics":{"reliability_score_v2":100,"packet_score":83.3333,"watchdog_score":100,"recovery_score":100,"overflow_score":100,"tx_score":100,"tx_packet_score":100,"dedup_score":100,"failed_checks":2,"reliability_score_v17":96.6102,"reliability_score_v16":96.6102,"reliability_score_v15":96.6102,"reliability_score_v14":96.6102,"reliability_score_v13":96.6102,"reliability_score_v12":96.6102,"reliability_score_v11":96.6102,"reliability_score_v10":96.6102,"reliability_score_v9":96.6102,"reliability_score_v8":96.6102,"reliability_score_v7":96.6102,"reliability_score_v6":96.6102,"reliability_score_v5":96.6102,"reliability_score_v4":96.6102,"reliability_score":96.6102,"crc_gate_present":0,"unit_seconds":0},"status":"keep","description":"Reinitialized benchmark with full 10-byte payload bounds invariants for packet parsing safety.","timestamp":1777581749321,"segment":1,"confidence":null,"asi":{"hypothesis":"Packet parser should reject frames unless the entire copied/decrypted 10-byte payload is inside the declared packet length.","notes":"Current bounds helper only proves payload[7] is in range; parse_fifo_packet memcpy/decode uses payload[9], so two new packet invariants fail.","next_focus":"Tighten packet_validation::is_valid_packet_bounds to require 28 + dests_len <= length while preserving FIFO cap.","safety":"Checks passed; baseline intentionally exposes the reliability gap."}}
{"run":5,"commit":"63e5429","metric":100,"metrics":{"reliability_score_v2":100,"packet_score":100,"watchdog_score":100,"recovery_score":100,"overflow_score":100,"tx_score":100,"tx_packet_score":100,"dedup_score":100,"failed_checks":0,"reliability_score_v17":100,"reliability_score_v16":100,"reliability_score_v15":100,"reliability_score_v14":100,"reliability_score_v13":100,"reliability_score_v12":100,"reliability_score_v11":100,"reliability_score_v10":100,"reliability_score_v9":100,"reliability_score_v8":100,"reliability_score_v7":100,"reliability_score_v6":100,"reliability_score_v5":100,"reliability_score_v4":100,"reliability_score":100,"crc_gate_present":0,"unit_seconds":0},"status":"keep","description":"Tightened packet bounds validation to cover the full copied/decrypted 10-byte payload.","timestamp":1777581762079,"segment":1,"confidence":null,"asi":{"hypothesis":"Bounds validation should match the parser's actual memcpy/decrypt footprint, not only the state byte access footprint.","impact":"Frames whose declared length cannot contain payload[9] are rejected before payload copy/decode, preventing status-byte or stale FIFO bytes from being treated as payload.","validation":"packet_score improved 83.33 -> 100; reliability_score_v18 improved 96.61 -> 100.","files":"components/elero/elero_packet_validation.h"}}
{"type":"config","name":"Elero reliability: retry-drop counter advancement","metricName":"reliability_score_v19","metricUnit":"","bestDirection":"higher"}
{"run":6,"commit":"3e9fe57","metric":98.3333,"metrics":{"reliability_score_v2":90,"packet_score":100,"watchdog_score":100,"recovery_score":100,"overflow_score":100,"tx_score":100,"tx_packet_score":100,"dedup_score":100,"failed_checks":1,"reliability_score_v18":98.3333,"reliability_score_v17":98.3333,"reliability_score_v16":98.3333,"reliability_score_v15":98.3333,"reliability_score_v14":98.3333,"reliability_score_v13":98.3333,"reliability_score_v12":98.3333,"reliability_score_v11":98.3333,"reliability_score_v10":98.3333,"reliability_score_v9":98.3333,"reliability_score_v8":98.3333,"reliability_score_v7":98.3333,"reliability_score_v6":98.3333,"reliability_score_v5":98.3333,"reliability_score_v4":98.3333,"reliability_score":98.3333,"crc_gate_present":0,"unit_seconds":0},"status":"keep","description":"Reinitialized benchmark with retry-drop counter-advancement invariants for partial-send failure safety.","timestamp":1777581816599,"segment":2,"confidence":null,"asi":{"hypothesis":"If a command is dropped after some repeats were already transmitted, the next queued command must not reuse the same rolling counter.","notes":"Current stale-queue path advances the counter for partial sends, but retry-drop path lacks an equivalent testable policy helper.","next_focus":"Add dispatch helper for counter advancement on drop and use it before popping failed partially-sent commands.","safety":"Checks passed; baseline intentionally fails helper-presence invariant."}}
{"run":7,"commit":"7618ad5","metric":100,"metrics":{"reliability_score_v2":100,"packet_score":100,"watchdog_score":100,"recovery_score":100,"overflow_score":100,"tx_score":100,"tx_packet_score":100,"dedup_score":100,"failed_checks":0,"reliability_score_v18":100,"reliability_score_v17":100,"reliability_score_v16":100,"reliability_score_v15":100,"reliability_score_v14":100,"reliability_score_v13":100,"reliability_score_v12":100,"reliability_score_v11":100,"reliability_score_v10":100,"reliability_score_v9":100,"reliability_score_v8":100,"reliability_score_v7":100,"reliability_score_v6":100,"reliability_score_v5":100,"reliability_score_v4":100,"reliability_score":100,"crc_gate_present":0,"unit_seconds":0},"status":"keep","description":"Advanced command counter when dropping a partially transmitted command after retry exhaustion.","timestamp":1777581834001,"segment":2,"confidence":null,"asi":{"hypothesis":"Retry exhaustion after partial transmission should consume the rolling counter, matching stale-queue cleanup semantics and avoiding replay-like reuse.","impact":"Dropped partially-sent commands now reset packet repeat accounting and advance the counter before the next queued command is sent.","validation":"dispatch_score improved 90 -> 100; reliability_score_v19 improved 98.33 -> 100.","files":"components/elero/elero_dispatch_logic.h, components/elero/elero.cpp"}}
{"type":"config","name":"Elero reliability: watchdog transient switch states","metricName":"reliability_score_v20","metricUnit":"","bestDirection":"higher"}
{"run":8,"commit":"adedc53","metric":96.9697,"metrics":{"reliability_score_v2":100,"packet_score":100,"watchdog_score":100,"recovery_score":100,"overflow_score":100,"tx_score":100,"tx_packet_score":100,"dedup_score":100,"radio_state_score":50,"failed_checks":2,"reliability_score_v19":96.9697,"reliability_score_v18":96.9697,"reliability_score_v17":96.9697,"reliability_score_v16":96.9697,"reliability_score_v15":96.9697,"reliability_score_v14":96.9697,"reliability_score_v13":96.9697,"reliability_score_v12":96.9697,"reliability_score_v11":96.9697,"reliability_score_v10":96.9697,"reliability_score_v9":96.9697,"reliability_score_v8":96.9697,"reliability_score_v7":96.9697,"reliability_score_v6":96.9697,"reliability_score_v5":96.9697,"reliability_score_v4":96.9697,"reliability_score":96.9697,"crc_gate_present":0,"unit_seconds":0},"status":"keep","description":"Reinitialized benchmark with radio watchdog transient-state invariants for TX/RX hardware switch states.","timestamp":1777581866102,"segment":3,"confidence":null,"asi":{"hypothesis":"CC1101 TXRX/RXTX switch MARC states are short-lived hardware transitions and should not consume watchdog recovery/escalation budget.","notes":"Current transient predicate excludes switch states, so radio_state_score is 50 with two failed invariants.","next_focus":"Treat TXRX_SWITCH and RXTX_SWITCH as watchdog-transient states while keeping FIFO overflow/underflow as non-transient error states.","safety":"Checks passed; baseline intentionally exposes watchdog classification gap."}}
{"run":9,"commit":"a652674","metric":100,"metrics":{"reliability_score_v2":100,"packet_score":100,"watchdog_score":100,"recovery_score":100,"overflow_score":100,"tx_score":100,"tx_packet_score":100,"dedup_score":100,"radio_state_score":100,"failed_checks":0,"reliability_score_v19":100,"reliability_score_v18":100,"reliability_score_v17":100,"reliability_score_v16":100,"reliability_score_v15":100,"reliability_score_v14":100,"reliability_score_v13":100,"reliability_score_v12":100,"reliability_score_v11":100,"reliability_score_v10":100,"reliability_score_v9":100,"reliability_score_v8":100,"reliability_score_v7":100,"reliability_score_v6":100,"reliability_score_v5":100,"reliability_score_v4":100,"reliability_score":100,"crc_gate_present":0,"unit_seconds":0},"status":"keep","description":"Classified CC1101 TX/RX switch MARC states as watchdog-transient instead of recovery-worthy faults.","timestamp":1777581877921,"segment":3,"confidence":null,"asi":{"hypothesis":"Watchdog should tolerate short CC1101 TX/RX and RX/TX switch states to avoid false recovery escalation during normal hardware turnarounds.","impact":"Switch states now follow existing calibration/RX_END transient handling; FIFO overflow/underflow remain non-transient error classifications.","validation":"radio_state_score improved 50 -> 100; reliability_score_v20 improved 96.97 -> 100.","files":"components/elero/elero_radio_state_logic.h"}}
{"run":10,"commit":"a652674","metric":100,"metrics":{"reliability_score_v2":100,"packet_score":100,"watchdog_score":100,"recovery_score":100,"overflow_score":100,"tx_score":100,"tx_packet_score":100,"dedup_score":100,"radio_state_score":100,"failed_checks":0,"reliability_score_v19":100,"reliability_score_v18":100,"reliability_score_v17":100,"reliability_score_v16":100,"reliability_score_v15":100,"reliability_score_v14":100,"reliability_score_v13":100,"reliability_score_v12":100,"reliability_score_v11":100,"reliability_score_v10":100,"reliability_score_v9":100,"reliability_score_v8":100,"reliability_score_v7":100,"reliability_score_v6":100,"reliability_score_v5":100,"reliability_score_v4":100,"reliability_score":100,"crc_gate_present":0,"unit_seconds":0},"status":"discard","description":"Documentation/backlog refresh after v18-v20 kept improvements; benchmark unchanged as expected.","timestamp":1777581899722,"segment":3,"confidence":null,"asi":{"hypothesis":"Refreshing autoresearch notes should preserve resumption quality without affecting reliability metrics.","rollback_reason":"Primary metric unchanged at 100; no code optimization to keep under experiment policy.","next_action_hint":"Continue with sequence-level queue/recovery simulations from autoresearch.ideas.md.","note":"autoresearch.md and autoresearch.ideas.md are preserved by discard handling."}}
{"type":"config","name":"Elero reliability: retry-drop stale timer refresh","metricName":"reliability_score_v21","metricUnit":"","bestDirection":"higher"}
{"run":11,"commit":"5bd4d37","metric":98.5075,"metrics":{"reliability_score_v2":92.3077,"packet_score":100,"watchdog_score":100,"recovery_score":100,"overflow_score":100,"tx_score":100,"tx_packet_score":100,"dedup_score":100,"radio_state_score":100,"failed_checks":1,"reliability_score_v20":98.5075,"reliability_score_v19":98.5075,"reliability_score_v18":98.5075,"reliability_score_v17":98.5075,"reliability_score_v16":98.5075,"reliability_score_v15":98.5075,"reliability_score_v14":98.5075,"reliability_score_v13":98.5075,"reliability_score_v12":98.5075,"reliability_score_v11":98.5075,"reliability_score_v10":98.5075,"reliability_score_v9":98.5075,"reliability_score_v8":98.5075,"reliability_score_v7":98.5075,"reliability_score_v6":98.5075,"reliability_score_v5":98.5075,"reliability_score_v4":98.5075,"reliability_score":98.5075,"crc_gate_present":0,"unit_seconds":0},"status":"keep","description":"Reinitialized benchmark with retry-drop stale-timer refresh invariant for queue progress after abandoned commands.","timestamp":1777581948128,"segment":4,"confidence":null,"asi":{"hypothesis":"Dropping a command after retry exhaustion is queue progress and should refresh the stale-queue timer so the next queued command is not immediately cleared by inherited age.","notes":"Current retry-drop path pops the failed command but leaves last_queue_drain_ms unchanged, unlike successful drains; one helper-presence invariant fails.","next_focus":"Add a dispatch helper for stale-timer refresh on drop and update last_queue_drain_ms after popping a dropped command.","safety":"Checks passed; baseline intentionally exposes queue aging gap."}}
{"run":12,"commit":"6bf9e7f","metric":100,"metrics":{"reliability_score_v2":100,"packet_score":100,"watchdog_score":100,"recovery_score":100,"overflow_score":100,"tx_score":100,"tx_packet_score":100,"dedup_score":100,"radio_state_score":100,"failed_checks":0,"reliability_score_v20":100,"reliability_score_v19":100,"reliability_score_v18":100,"reliability_score_v17":100,"reliability_score_v16":100,"reliability_score_v15":100,"reliability_score_v14":100,"reliability_score_v13":100,"reliability_score_v12":100,"reliability_score_v11":100,"reliability_score_v10":100,"reliability_score_v9":100,"reliability_score_v8":100,"reliability_score_v7":100,"reliability_score_v6":100,"reliability_score_v5":100,"reliability_score_v4":100,"reliability_score":100,"crc_gate_present":0,"unit_seconds":0},"status":"keep","description":"Refreshed stale-queue timer after retry-dropping an abandoned command to avoid cascading stale clears.","timestamp":1777581966829,"segment":4,"confidence":null,"asi":{"hypothesis":"A retry-dropped command should reset queue-aging state because the queue made progress, protecting remaining commands from inheriting stale age.","impact":"After popping an exhausted command, last_queue_drain_ms is refreshed; partial-send counter advancement from v19 is preserved.","validation":"dispatch_score improved 92.31 -> 100; reliability_score_v21 improved 98.51 -> 100.","files":"components/elero/elero_dispatch_logic.h, components/elero/elero.cpp"}}
{"type":"config","name":"Elero reliability: cover poll inclusive boundary","metricName":"reliability_score_v22","metricUnit":"","bestDirection":"higher"}
{"run":13,"commit":"ec24ef0","metric":98.5714,"metrics":{"reliability_score_v2":100,"packet_score":100,"watchdog_score":100,"recovery_score":100,"overflow_score":100,"tx_score":100,"tx_packet_score":100,"dedup_score":100,"radio_state_score":100,"cover_score":0,"failed_checks":1,"reliability_score_v21":98.5714,"reliability_score_v20":98.5714,"reliability_score_v19":98.5714,"reliability_score_v18":98.5714,"reliability_score_v17":98.5714,"reliability_score_v16":98.5714,"reliability_score_v15":98.5714,"reliability_score_v14":98.5714,"reliability_score_v13":98.5714,"reliability_score_v12":98.5714,"reliability_score_v11":98.5714,"reliability_score_v10":98.5714,"reliability_score_v9":98.5714,"reliability_score_v8":98.5714,"reliability_score_v7":98.5714,"reliability_score_v6":98.5714,"reliability_score_v5":98.5714,"reliability_score_v4":98.5714,"reliability_score":98.5714,"crc_gate_present":0,"unit_seconds":0},"status":"keep","description":"Reinitialized benchmark with cover poll inclusive-boundary invariant.","timestamp":1777582017836,"segment":5,"confidence":null,"asi":{"hypothesis":"Scheduled cover polls should fire at the exact interval boundary instead of one loop tick later, matching other inclusive timing semantics and avoiding avoidable status latency.","notes":"Current cover loop uses a strict greater-than poll interval comparison; helper-presence invariant fails with cover_score=0.","next_focus":"Add a pure cover_logic::should_poll helper with >= semantics and route EleroCover::loop polling through it.","safety":"Checks passed; baseline intentionally exposes cover polling boundary gap."}}
{"run":14,"commit":"c03d3b5","metric":100,"metrics":{"reliability_score_v2":100,"packet_score":100,"watchdog_score":100,"recovery_score":100,"overflow_score":100,"tx_score":100,"tx_packet_score":100,"dedup_score":100,"radio_state_score":100,"cover_score":100,"failed_checks":0,"reliability_score_v21":100,"reliability_score_v20":100,"reliability_score_v19":100,"reliability_score_v18":100,"reliability_score_v17":100,"reliability_score_v16":100,"reliability_score_v15":100,"reliability_score_v14":100,"reliability_score_v13":100,"reliability_score_v12":100,"reliability_score_v11":100,"reliability_score_v10":100,"reliability_score_v9":100,"reliability_score_v8":100,"reliability_score_v7":100,"reliability_score_v6":100,"reliability_score_v5":100,"reliability_score_v4":100,"reliability_score":100,"crc_gate_present":0,"unit_seconds":0},"status":"keep","description":"Made scheduled cover polling fire at the exact interval boundary via a shared cover_logic helper.","timestamp":1777582036250,"segment":5,"confidence":null,"asi":{"hypothesis":"Inclusive cover poll timing removes a one-tick status-update blind spot and keeps cover polling consistent with runtime blind and dispatch timing semantics.","impact":"EleroCover::loop now routes scheduled polling through cover_logic::should_poll with >= semantics; behavior only changes at the exact interval boundary.","validation":"cover_score improved 0 -> 100; reliability_score_v22 improved 98.57 -> 100.","files":"components/elero/elero_cover_logic.h, components/elero/cover/EleroCover.cpp"}}
{"type":"config","name":"Elero reliability: light dimming publish inclusive boundary","metricName":"reliability_score_v23","metricUnit":"","bestDirection":"higher"}
{"run":15,"commit":"fc775b0","metric":98.6301,"metrics":{"reliability_score_v2":100,"packet_score":100,"watchdog_score":100,"recovery_score":100,"overflow_score":100,"tx_score":100,"tx_packet_score":100,"dedup_score":100,"radio_state_score":100,"cover_score":100,"light_score":0,"failed_checks":1,"reliability_score_v22":98.6301,"reliability_score_v21":98.6301,"reliability_score_v20":98.6301,"reliability_score_v19":98.6301,"reliability_score_v18":98.6301,"reliability_score_v17":98.6301,"reliability_score_v16":98.6301,"reliability_score_v15":98.6301,"reliability_score_v14":98.6301,"reliability_score_v13":98.6301,"reliability_score_v12":98.6301,"reliability_score_v11":98.6301,"reliability_score_v10":98.6301,"reliability_score_v9":98.6301,"reliability_score_v8":98.6301,"reliability_score_v7":98.6301,"reliability_score_v6":98.6301,"reliability_score_v5":98.6301,"reliability_score_v4":98.6301,"reliability_score":98.6301,"crc_gate_present":0,"unit_seconds":0},"status":"keep","description":"Reinitialized benchmark with light dimming publish inclusive-boundary invariant.","timestamp":1777582091778,"segment":6,"confidence":null,"asi":{"hypothesis":"Estimated light brightness should publish at the exact dimming publish interval boundary, avoiding the same one-tick status-update blind spot fixed for cover polling.","notes":"Current EleroLight::loop uses strict `now - last_publish_ > 1000`; light helper-presence invariant fails with light_score=0.","next_focus":"Add light_logic::should_publish_dimming with >= semantics and route dimming publish check through it.","safety":"Checks passed; baseline intentionally exposes light dimming publish boundary gap."}}
